"","created_time","snippet","headline","wordcount","section"
"229","2010-10-01T14:30:59+0000","Tate Modern is offering ""Gauguin, Maker of Myth,"" which focuses on the ideas that would haunt the painter all his life.","Gauguin, Obsessive Chameleon",1389,"Arts"
"230","2010-08-12T17:00:35+0000","Guest blogger Sher Bano writes about recent protests in Pakistan over Facebook.","Report From a Pashtun Teen: Facebook Protests in Pakistan",1273,"Opinion"
"231","2010-06-14T17:55:39+0000","In Capital One spots, are they Vikings or Visigoths? And what’s the difference?","Q. and A. With Stuart Elliott",398,"Business Day"
"232","2010-01-29T19:28:58+0000","In a surprising turn of events, American designers are being celebrated in Paris, the apogee of chic.","Now Showing | ‘Americans in Paris’",364,"T Magazine"
"233","2010-08-18T23:55:40+0000","Beauty Spots.","Beauty Spots",327,"Fashion & Style"
"234","2010-04-27T00:18:37+0000","Prime Minister Vladimir V. Putin mocked a reporter’s question about the secrets to success in a “political marriage,” saying he and President Dmitri A. Medvedev were just friends.","Russia’s Power (and Strictly Platonic) Couple",325,"World"
"235","2010-08-12T13:10:38+0000","Air quality improved for a second day in Moscow, as the wind shifted and firefighters extinguished a number of the fires burning near the capital.","Russia Breathes Easier as Moscow Skies Clear",329,"World"
"236","2010-04-02T12:35:58+0000","Global investments were up 29 percent from the fourth quarter of 2009 and 83 percent from the same quarter a year ago, according to a new report.","Clean Technology Investments Bounce Back",304,"Business Day"
"237","2010-02-18T16:11:31+0000","A review of each country’s most recent forecast suggests that all but six nations will meet or exceed their national renewable energy goals for 2020.","E.U. Countries Vie to Meet Renewable Goals",342,"Business Day"
"238","2010-01-30T00:29:33+0000","Black Forest Bakery and Cafe offers not only its namesake sweet but a range of other treats. There is salad, too, if necessary.","Making Dessert the First, or Perhaps Only, Course",281,"New York"
"239","2010-05-11T15:07:12+0000","The “Straightforward: New Finnish Design” exhibition at Chelsea Market highlights Finland’s bold, functional and avant-garde designs.","On Design | Those Fabulous Finns",317,"T Magazine"
"240","2010-03-22T10:00:52+0000","Finding a good, authentic croissant in Hong Kong has gotten a little easier. Bakeries in the city are still mostly dominated by chains, but several unique spots have been shaking up the scene, particularly a handful of spots specializing in tradit...","Where to Satisfy a Sweet Tooth in Hong Kong",295,"Travel"
"241","2010-01-07T08:47:28+0000","Iceland’s government says it sees no immediate political solution to contain the fallout of President Olafur R. Grimsson’s decision to veto a depositor bill that had sought to repair U.K. and Dutch diplomatic relations.","Iceland Pinched by Pressures at Home and Abroad",285,"Business Day"
"242","2010-06-05T19:48:15+0000","Every four years, young players use the platform of the World Cup to become household names. Here’s a look at a contender from each group to emerge in South Africa.","World Cup 2010: The Young Guns",796,"Sports"
"243","2010-01-18T01:49:44+0000","A Danish staff member was pulled from the rubble on Sunday, and during a visit, Secretary General Ban Ki-moon expressed sympathy for those still trapped.","A Rescue at U.N. Headquarters, as Others Wait and Hope",746,"World"
"244","2010-06-01T19:40:33+0000","Francesca Schiavone became the first Italian woman to reach a Grand Slam semifinal in the Open era, and Elena Dementieva of Russia also advanced.","Schiavone in Semifinals After Her Latest Upset",804,"Sports"
"245","2010-02-08T16:08:33+0000","The feeding frenzy in bond markets over highly indebted southern euro states recalls the runs on European currencies in the 1990s, before the euro was created.","Market Frenzy Over Greece Is Disturbingly Familiar",828,"Business Day"
"246","2010-01-02T00:50:41+0000","Under a state bill, buyers would be warned that cellphones may cause brain cancer, despite conflicting evidence.","Maine to Consider Putting Warnings on Cellphones",857,"U.S."
"247","2010-06-24T17:58:28+0000","Can Cameroon and Paul LeGuen snap a nine-game winless streak against Group E favorite the Netherlands, and end their World Cup on a high?","World Cup Live: Cameroon vs. Netherlands",2522,"Sports"
"248","2010-11-11T19:46:35+0000","United States Coach Bob Bradley announced his roster for the Americans’ friendly against South Africa in Cape Town later this month.  He decided to give five players who have never before played for the national team an opportunity.","Bradley Names U.S. Roster for South Africa Trip",317,"Sports"
"249","2010-06-25T16:04:28+0000","The perfect is the enemy of the good: That might have been the case this week in Agadir, Morocco, where the International Whaling Commission failed to make any progress on reducing the global whale catch.","Enemy of the Good? The Whaling Stalemate",393,"Science"
"250","2010-07-15T22:54:25+0000","“Valhalla Rising,” directed by Nicolas Winding Refn, is an epic tale of Viking warriors who find themselves in the new world before it’s the New World. ","A Nordic Epic",380,"Movies"
"251","2010-09-08T19:55:44+0000","Vera Zvonareva of Russia, powered her way into the women’s semifinals with a hard-fought victory over Kaia Kanepi of Estonia, 6-3, 7-5.","Zvonareva Overcomes Kanepi to Reach Semis",337,"Sports"
"252","2010-09-03T02:00:01+0000","A tough Friday puzzle to make you question the morning after.","Friday: Beautiful Boy",379,"Crosswords & Games"
"253","2010-01-05T19:20:28+0000","Think, the electric carmaker, is the latest company to set up shop in Indiana’s new “Silicon Valley for electric vehicles.”","Think, an Electric Car, to Be Built in Indiana",395,"Automobiles"
"254","2010-12-27T13:17:52+0000","Police believed the bomb was the work of the anarchist group that sent two similar packages last week.","Mail Bomb Defused at Rome Embassy",383,"World"
"255","2010-10-11T11:31:32+0000","The outstanding matchups in Euro 2012 qualification, all scheduled for  Tuesday.","Key Matchups: Euro 2012 Qualifiers",343,"Sports"
"256","2010-03-16T19:11:03+0000","With ocean-going trade slackening amid the global recession, shipping companies and shipyard operators in Europe are finding the offshore wind industry to be a welcome ally in weathering the bad times.","Offshore Wind a Boon to the Shipping Industry",358,"Business Day"
"257","2010-07-01T21:11:15+0000","There are eight teams left in the World Cup and three shirt manufacturers vying for the crown.","The Shirt World Cup Is Down to Adidas, Nike and Puma",316,"Sports"
"258","2010-01-25T21:09:11+0000","An accused Ponzi artist is jailed because he failed to turn over his submarine, among other things.","Surrender That Submarine",346,"Business Day"
"259","2010-09-01T05:28:28+0000","After waiting hours to get on court, No. 1 seed Caroline Wozniacki required only 61 minutes to dispatch Chelsea Gullickson 6-1, 6-1 to advance to the second round.","Wozniacki Wins With Speed and Ease",326,"Sports"
"260","2010-05-06T22:13:14+0000","Ticket sales have reached 76,152 in Germany, exceeding the current record for hockey, the 74,554 who attended the Michigan-Michigan State “Cold War” game in East Lansing in 2001.","Record Crowd Expected for U.S.-Germany Game",346,"Sports"
"261","2010-03-26T17:24:54+0000","Three new movies show that it is possible to bypass or subvert official channels when dealing with North Korea.","Restricted, but Not Deterred",1381,"Movies"
"262","2010-06-10T11:31:51+0000","The Danish driver Tom Kristensen, 42, holds the record of eight victories for a driver in the Le Mans 24-Hour race - ahead of Jacky Ickx with six. He recently spoke with Brad Spurgeon of the International Herald Tribune.","Record-Winning Driver Shares His Victories",1476,"Sports"
"263","2010-11-24T18:27:09+0000","<HR SIZE=""1"" WIDTH=""25"" ALIGN=""LEFT""/>
<FONT SIZE=""-1"">U.N. REJECTS DELAY</FONT>
<HR SIZE=""1"" WIDTH=""25"" ALIGN=""LEFT""/>
<FONT SIZE=""-1"">Proposal Driven Through by U.S. and Soviet Will Set Up Two Sates</FONT>
<HR SIZE=""1"" WIDTH=""25"" ALIGN=""LEFT""/>
...","<B>ASSEMBLY VOTES PALESTINE PARTITION; MARGIN IS 33 TO 13; ARABS WALK OUT; ARANHA HAILS WORK AS SESSION ENDS</B>
",1493,"The Learning Network"
"264","2010-08-08T22:56:49+0000","An array of international stars performed at Damian Woetzel’s International Evenings of Dance in Colorado.","Ballet Adds Human Splendor to Wonders of Vail",1282,"Arts"
"265","2010-10-11T19:44:10+0000","Researchers suggest there is something to the “use it or lose it” notion. But not everyone is convinced.","Taking Early Retirement May Retire Memory, Too",1050,"Science"
"266","2010-06-08T12:10:40+0000","The U.S. should look across the Atlantic for ideas on how to reduce its ecological footprint.","Europe Energized",840,"Opinion"
"267","2010-06-13T21:16:37+0000","Ib Andersen has made his Ballet Arizona into formidable interpreters of his mentor, George Balanchine.","Balanchine Protégé Transplants the Spirit to the Southwest",934,"Arts"
"268","2010-11-29T02:52:11+0000","Mr. Nielsen was a Canadian-born actor who in middle age tossed aside three decades of credibility in dramatic and romantic roles to make a new career as a comic actor.","Leslie Nielsen, 84, Romantic Hero Turned Comic, Dies",889,"New York"
"269","2010-12-18T00:33:25+0000","Sarah Bakewell’s biography of Montaigne, “How to Live,” takes the form of a delightful conversation across the centuries on the question of its title.","Conversation Across Centuries With the Father of All Bloggers",974,"Books"
"270","2010-12-22T17:30:24+0000","As the Atlantic mackerel migrates farther north and west in the spring and summer, Icelandic fishermen enjoy a bonanza.","Iceland Defies Europeans on Mackerel Catch",932,"Science"
"271","2010-01-11T21:36:42+0000","The causes for bed-wetting in children can be genetic, developmental and physiological, but the problem itself is quite treatable.","To Treat Bed-Wetting, Healthy Doses of Patience",913,"Health"
"272","2010-11-23T12:54:00+0000","Freddy Adu, who turned pro with D.C. United of M.L.S. at the age of 14, is now struggling to find a team to give him a chance.","A Talent Burning Too Brightly, Too Young",976,"Sports"
"273","2010-06-14T13:39:17+0000","Long shots Japan and Cameroon face off in the second match of Monday’s World Cup.","Japan Eases Past Cameroon",1505,"Sports"
"274","2010-12-02T16:20:24+0000","Imagine if you had to calculate a new tax rate for each additional $2,000 of income you earned. That was the case for many households in 1975.","Should Tax Rates Be More Gradual?",419,"Business Day"
"275","2010-07-08T19:10:23+0000","The layoffs are the result of the company’s merger with Schering-Plough. It will also close research and manufacturing sites around the world.","Merck Plans Layoff of 15% of Work Force",428,"Health"
"276","2010-09-20T12:56:56+0000","When great players die, memorable defeats also become a staple of their legacies.","Great Players Remembered for Big Wins, and Big Losses",388,"Crosswords & Games"
"277","2010-07-15T21:57:41+0000","If the intent was to make a difficult hole more difficult, British Open organizers appear to have succeeded. The modified par-4 17th hole was by far the most challenging hole on the Old Course during the first round of the British Open. That shoul...","No. 17 Bares Its Teeth at British Open",421,"Sports"
"278","2010-12-01T23:03:30+0000","In Orlando, the Hampton team wins the Sternberg Women’s Board-a-Match event.","A Single Deal Proves Crucial as a Title Is Defended",393,"Crosswords & Games"
"279","2010-08-23T19:05:23+0000","The younger players built a formidable lead and then held on to win the match.","Rising Stars Win NH Chess Tournament",434,"Crosswords & Games"
"280","2010-07-09T00:41:27+0000","The restructuring follows a merger of the drug giants Merck and Schering-Plough, and involves closing eight research and eight manufacturing sites worldwide.","Merck Plans to Lay Off About 15% of Workers",440,"Health"
"281","2010-05-09T21:48:22+0000","Look & Listen, a new music festival that incorporates contemporary art, found room for some old music too.","Found Objects and Other Percussive Items",438,"Arts"
"282","2010-02-09T15:56:20+0000","“We want to be one of the leading companies on the American market,” Andreas Nauen, the chief executive of Siemens Wind Power, told Green Inc. on Monday.","Siemens Touts Growth in Renewables and the Value of the American Market",411,"Business Day"
"283","2010-12-01T17:06:38+0000","The European Financial Stability Facility may issue between 5 billion euros and 8 billion euros of bonds, the fund’s chief executive officer said in Singapore.","Europe's Bailout Fund May Sell First Bonds in January",381,"Business Day"
"284","2010-02-12T22:30:26+0000","February in this city belongs increasingly to — no, not fashion — but to flamenco and all its attendant regalia.","Flamenco, Past and (Very) Present",435,"T Magazine"
"285","2010-10-12T20:23:39+0000","Public opinion and the roots of G.O.P. climate-change skepticism.","Why Don’t Republicans Believe in Climate Change?",446,"Opinion"
"286","2010-09-09T17:04:04+0000","Some suggestions — for artists and for parents — to help create a meaningful theatergoing experience for kids.","Theater Talkback: Children’s Theater the Right Way",474,"Arts"
"287","2010-08-18T17:32:21+0000","Sales, store openings and pop-ups in New York City.","Scouting Report",381,"Fashion & Style"
"288","2010-05-13T11:01:02+0000","Highlights from the I.H.T. archives.","100, 75, 50 Years Ago",446,"Opinion"
"289","2010-03-15T11:00:31+0000","Terraced up the northern foothills of Tai Mo Shan, Hong Kong’s highest peak, Kadoorie Farm and Botanic Garden gives visitors a glimpse of Hong Kong’s natural charms, complete with trails and gardens that are ideal for a day of relaxing exploration...","Near Urban Hong Kong, a Taste of the Farm",377,"Travel"
"290","2010-02-01T21:45:41+0000","Mariann Fischer Boel is preparing to step down as Europe’s agricultural commissioner after five years of struggling to cut back the most generous farm subsidy system in the world.","Farm Subsidy Battles: A Fighter Looks Back",970,"World"
"291","2010-07-01T18:46:25+0000","Biologists found that at least 30 genes had undergone change as Tibetans adapted to life on the high plateau.","Scientists Cite Fastest Case of Human Evolution",1061,"Science"
"292","2010-03-28T15:58:25+0000","With global markets on the upswing, experts say that the wireless industry is poised for a wave of mergers that could reshape it.","Telecom Industry Ripe for Consolidation",1033,"Technology"
"293","2010-11-02T23:57:00+0000","There are diplomatic reasons to not mention Russia and Iran as threats, but a new antimissile system would exist partly because of them.","NATO Sees Threats, but Is Reluctant to Say Just Who the Enemy Might Be",1067,"World"
"294","2010-09-15T15:42:10+0000","In a corner of the airport near Amsterdam, a library sends out its siren's call.","At Schiphol, an Unlikely Sanctuary of Books",1024,"Arts"
"295","2010-12-07T18:30:19+0000","The battle between Disney and the Animated Film Society spills over in the Oscars of the cartoon world.","Feuding in Cartoon Land",479,"Arts"
"296","2010-11-03T22:37:10+0000","DONETSK, Ukraine (Reuters) - Eduardo da Silva came back to haunt his former club as he scored the winner in Shakhtar Donetsk's 2-1 comeback win over Arsenal in a fast-flowing Champions League match on Wednesday.","Eduardo Haunts Old Club as Shakhtar Beat Arsenal",419,"Sports"
"297","2010-08-31T21:34:28+0000","The French government — amid wide criticism for deportation of hundreds of Roma — defended its actions on Tuesday and accused Romania of not doing enough to integrate members of its Roma minority.","France Mounts Defense of Its Deportation of Roma",432,"World"
"298","2010-04-14T20:40:13+0000","The Polish trumpeter Tomasz Stanko and his quintet delivered melancholy jazz at Birdland on Tuesday night.","Jazz Tinged With Sorrow as Well as Somber Beauty",453,"Arts"
"299","2010-07-07T00:42:41+0000","Renesas Electronics of Japan will buy the wireless modem business, which has been hurt by Chinese competition, for $200 million.","Nokia to Sell Its Business in Modems",433,"Technology"
"300","2010-04-01T13:30:34+0000","The focus of the cycling world this week is not on the racers in Belgium, but on the announcement of the line-up for the Tour de France.","Familiar Faces, and No Surprises, in Tour De France Lineup",493,"Sports"
"301","2010-12-30T22:15:45+0000","New York State paid $30 million to secure conservation rights on tens of thousands of acres of forest in the Adirondacks.","New York State Buys Conservation Rights for 89,000 Acres of Forest",484,"Science"
"302","2010-02-16T18:31:09+0000","Two of the world’s leading companies in the enzyme business, Novozymes and Danisco, announced this week that they had developed enzymes that could reliably and affordably convert agricultural waste into so-called cellulosic ethanol.","Cellulosic Fuel Gets Cheaper, Companies Say",432,"Business Day"
"303","2010-02-09T10:51:07+0000","SAS, the Scandinavian airline group, said Tuesday that it would issue new shares to raise capital and cut about 700 jobs after reporting a loss for 2009.","SAS to Issue Shares and Cut Jobs After 2009 Loss",465,"Business Day"
"304","2010-08-31T21:05:46+0000","Bjorn Lomborg’s latest book is unlikely to bolster his popularity among those opposed to drastic immediate action to curb greenhouse gas emissions.","A Warming Contrarian Calls for a Global Tax",417,"Science"
"305","2010-08-17T23:56:43+0000","A court is investigating charges that Google broke Spanish law while gathering photographs for Street View, its photo-mapping service.","Google Sued in Spain Over Data Collecting",469,"Technology"
"306","2010-08-15T00:05:42+0000","In most tournaments, the margin between a No. 1 seed and most of the field is often small, and the top player is usually not the prohibitive favorite.","For Top Seeds, No Guarantee of Victory, or Success",481,"Crosswords & Games"
"307","2010-07-06T10:32:29+0000","Nokia said Tuesday it would sell its wireless modem business, which has been hurt by Chinese competition, to Renesas Electronics of Japan for $200 million, The New York Times’s Kevin J. O’Brien reports.","Nokia to Exit Wireless Modem Business",418,"Business Day"
"308","2010-11-06T12:28:51+0000","Beginning with this installment, the Goal blog is starting a new feature that offers a statistical (courtesy of OPTA) and graphic representations of select matches from the European Champions League.","Champions League Chalkboards",446,"Sports"
"309","2010-07-30T16:20:08+0000","Video scenes of the latest slaughter of marine mammals in a bloody cove are interpreted very differently by different factions.","Varied Views of Bloody Coves",489,"Opinion"
"310","2010-06-30T23:39:46+0000","The top goals of South Africa 2010 through the group phase and the Round of 16.","The Goal of the Tournament So Far",471,"Sports"
"311","2010-05-24T18:30:04+0000","Architects, artists and designers have created conceptual habitats for animals in the Presidio of San Francisco.","Creature Comforts | The Presidio Habitats",452,"T Magazine"
"312","2010-12-03T18:58:59+0000","The days of Europe's motoring law free-for-all appear to be numbered. Under a new deal the E.U. nations plan to step up cooperation in enforcing penalties levied for offenses.","Deal Makes Traffic Fines Traceable Across Europe",457,"World"
"313","2010-03-09T21:47:35+0000","Discussion of the Metropolitan Opera production.","Regarding ‘The Nose': And the Eye, and the Ear",464,"Arts"
"314","2010-12-04T00:16:39+0000","At climate talks, officials rebut a rumor of a back-room deal not to extend emissions restrictions under the Kyoto Protocol.","(Non)Rumors Over ‘Non-Papers’ at Climate Talks",494,"Opinion"
"315","2010-10-11T21:45:05+0000","At Atlanta’s power core is deep-rooted music and an art scene that exerts an illuminating influence over the rest of the country’s cultural landscape.","We Three Things | The ATL",444,"T Magazine"
"316","2010-08-13T16:50:10+0000","The NH Tournament pits five younger players against five veteran players. After two rounds, the youngsters have a small lead.","An Annual Generational Clash Is Underway",462,"Crosswords & Games"
"317","2010-01-26T18:09:48+0000","Africa’s Lake Kivu could provide vast stores of methane for energy use — though it is not without its hazards.","Tapping Methane at Lake Kivu in Africa",465,"Business Day"
"318","2010-03-18T19:00:44+0000","After decades of being told when they can give birth and how often, China's women usually follow their heads, not their hearts.","Navigating Child Policy in China",1022,"World"
"319","2010-01-14T22:04:10+0000","An art program promises to deliver “a little cheer, whimsy and excitement” to construction sites below Canal Street.","Bringing Some Whimsy to Construction Sites",1124,"Arts"
"320","2010-06-03T22:10:33+0000","Rediscovering the art of Peter Sekaer, a photographer who worked with Walker Evans.","Finding Other America in Slums and on Farms",1088,"Arts"
"321","2010-02-17T01:59:11+0000","Halving a container ship’s top speed cuts fuel consumption and emissions of greenhouse gases.","Slow Trip Across Sea Aids Profit and Environment",1102,"Business Day"
"322","2010-01-04T03:22:50+0000","Congress should fashion a national response to climate change after green initiatives made by states and cities.","Where the Action Is on Climate",450,"Opinion"
"323","2010-09-19T19:59:00+0000","Sweden became the latest European nation to see a breakthrough for a populist anti-immigration party.","Swedish Anti-Immigration Party Claims Seats",502,"World"
"324","2010-09-15T23:06:38+0000","Using salvaged materials, a designer couple created a contemporary office and home for their young family in a townhouse in the Mission district.","A Modern Patchwork in San Francisco",529,"Home & Garden"
"325","2010-07-06T17:23:45+0000","Nokia is selling the business to Renesas Electronics of Japan for $200 million, as stiff competition from Chinese companies has driven down prices for the products.","Nokia to Exit Wireless Modem Business",473,"Business Day"
"326","2010-02-10T18:22:18+0000","American dreams be damned. It appears the United States has less intergenerational social mobility than many other industrialized countries.","Are You Better Off Than Your Parents Were?",501,"Business Day"
"327","2010-10-19T20:39:07+0000","A mysterious, seductive collaboration between the neurologist Oliver Sacks, the photographer Abelardo Morell and the designer Ted Muehling about the natural history of a Micronesian island is an artifact in itself.","Artful Books | The Island of Rota",507,"T Magazine"
"328","2010-09-29T18:51:54+0000","The European Commission gave Spain permission to subsidize its domestic coal industry for four more years on Wednesday, prompting sharp criticism from environmental groups.","Spain Wins E.U. Green Light to Subsidize Coal for 4 More Years",456,"Business Day"
"329","2010-07-24T23:49:37+0000","The deadly stampede inside a tunnel came after mass panic broke out at the popular Love Parade music festival in Duisburg.","Stampede at German Music Festival Kills 18",482,"World"
"330","2010-10-01T22:38:01+0000","A wall of circuit-wired instruments, comes to life like a player piano as Pat Metheny manipulates the foot pedals.","A Digital Update on the One-Man Band",489,"New York"
"331","2010-09-15T18:58:14+0000","The two countries had been negotiating their maritime boundary since 1970, but the talks took on new urgency as the polar ice cap has receded.","Russia and Norway Agree on Boundary",512,"World"
"332","2010-09-29T19:34:12+0000","This year’s London Design Festival may have ended, but the city’s design stores are open year-round. One neighborhood, Shoreditch, houses some of the most interesting examples.","London Underground | Shopping Shoreditch",484,"T Magazine"
"333","2010-09-02T00:13:33+0000","The world’s most developed economies face record levels of debt as a result of the 2008-9 financial crisis and have little room to maneuver, the I.M.F. warned.","Monetary Fund Warns G-7 on Debt Levels",478,"Business Day"
"334","2010-08-26T02:31:50+0000","Mr. Rowland’s invention, which was an alternative to the folding chair, made it possible to store many chairs in a small space.","David Rowland, Maker of a Tidily Stacked Chair, Dies at 86",527,"Business Day"
"335","2010-02-16T20:35:57+0000","On Monday night Axiom opened its final pairing of its current season with a concert devoted to works by Finnish composers.","From Finland, Northern Lights and a Clarinet",413,"Arts"
"336","2010-01-30T19:22:10+0000","As the main stage at the World Economic Forum was dominated by the United States and China, a side discussion focused on Europe’s diminishing role in global affairs.","Europe Agonistes",485,"Business Day"
"337","2010-03-09T22:10:46+0000","Arsenal sailed past Porto 5-0 and overturned a first-leg deficit with nonchalant ease to reach the quarter-finals of the Champions League.","Arsenal Crush Porto Thanks to Bendtner Hat - Trick",486,"Sports"
"338","2010-12-06T18:40:04+0000","A State Department cable released by WikiLeaks provides a compendium of sites around the world that, if lost, might “critically impact” the United States.","Leaked Cable Lists Sensitive Sites",532,"World"
"339","2010-11-22T18:36:49+0000","A lot of the old mujaheddin leaders who fought against the Soviets were dubious about sending American tanks to Afghanistan.","Sending Tanks to Afghanistan",500,"World"
