"","created_time","snippet","headline","wordcount","section"
"796","2007-02-21T05:00:00+0000","","U.K. to begin Iraq withdrawal - Europe - International Herald Tribune",1007,"World"
"797","2007-02-16T05:00:00+0000","","Review: Ledyard - Culture - International Herald Tribune",1028,"Arts"
"798","2007-11-25T05:00:00+0000","Through his own story, James D. Watson presents a guide to leading the scientific life.","So You Want to Be a Nobelist",959,"Books"
"799","2007-12-30T05:00:00+0000","In a sports year unlike any other, 2007 too often meant scandal and sadness rather than success.","Breaching the Field of Play, Sports Tumbled Out of Bounds",1015,"Sports"
"800","2007-10-08T05:00:00+0000","","Lars and the Real Girl: Guy and doll, and the woman behind them",979,"Arts"
"801","2007-08-16T05:00:00+0000","","ChthoniC: A heavy metal alloy of music and politics",903,"Arts"
"802","2007-08-02T05:00:00+0000","","Lessons from New Zealand: Farming without subsidies",1064,"Business Day"
"803","2007-07-29T04:00:00+0000","Alberto Contador, a 24-year-old rider with the Discovery Channel team, entered the race as a long-shot contender.","Spaniard Contador Wins Tour de France",1015,"Sports"
"804","2007-07-20T04:00:00+0000","The Frick Collection offers a gem of a show  on ormolu-mounted porcelain jars.","Chinese Porcelain With a French Twist",1047,"Arts"
"805","2007-06-27T05:00:00+0000","","Turkey's military seeks guidelines to attack Kurdish rebels",999,"World"
"806","2007-06-24T05:00:00+0000","","A new road map for Europe",1046,"World"
"807","2007-06-17T04:00:00+0000","One company’s battle to build a wind farm in Nantucket Sound.","Air Power",967,"Books"
"808","2007-06-17T05:00:00+0000","","Kinder, not killer, video games",1022,"Technology"
"809","2007-06-01T05:00:00+0000","","Making amends for 'dirty' air travel The Business of Green",993,"Business Day"
"810","2007-05-14T05:00:00+0000","","Indie musicians in Mexico City play to the world",964,"Arts"
"811","2007-06-01T05:00:00+0000","","Making amends for 'dirty' air travel The Business of Green",993,"Business Day"
"812","2007-03-11T05:00:00+0000","If the tax collector gets his way, members of the leveraged-buyout crowd could soon be forced to add some zeros to the taxable income line on their federal forms.","Of Private Equity, Politics and Income Taxes",1036,"Business Day"
"813","2007-03-21T05:00:00+0000","","Gore pleads for environment before U.S. Congress",992,"World"
"814","2007-11-13T05:00:00+0000","New books on global warming steer away from partisanship and urge a move to the pragmatic center on climate and energy.","Challenges to Both Left and Right on Global Warming",1045,"Science"
"815","2007-11-09T05:00:00+0000","","Harmony out of reach at EU-Africa summit",1031,"World"
"816","2007-10-02T05:00:00+0000","","The Arctic's alarming sea change",1009,"World"
"817","2007-09-24T00:00:00+0000","","“College” Isn’t Lost Yet",1045,"Magazine"
"818","2007-08-24T04:00:00+0000","In a retail market keen on the word “natural,” exports of Brazil’s beauty products have been rising quickly.","Beautifying the World With Amazon Ingredients ",1005,"Business Day"
"819","2007-07-25T04:00:00+0000","Alexandre Vinokourov tested positive for a banned blood transfusion, prompting his team to pull out of the race.","After Positive Test, Team Quits Tour de France",1028,"Sports"
"820","2007-06-28T04:00:00+0000","Aren’t the architects of Asymptote a bit too avant-garde for a luxury condo building in the West Village?","A Luxury Condo by Arty Architects From the Fringe",1046,"Arts"
"821","2007-04-01T05:00:00+0000","","Sports organizations' new event: Guarding online revenue",1028,"Technology"
"822","2007-02-28T05:00:00+0000","","A guide for those who don't read, but wish they did",987,"World"
"823","2007-02-24T05:00:00+0000","Win or lose Sunday night at the Academy Awards, Deepa Mehta’s “Water” will already have scored its greatest triumph simply by existing.","Indian Film With Roots So Deep That It Defies Borders",969,"Movies"
"824","2007-02-18T05:00:00+0000","The explorer John Ledyard was “the archetype of the restless American wanderer,” says Bill Gifford.","Hard Traveler",1031,"Books"
"825","2007-02-17T05:00:00+0000","Organizers of the Tour of California, who boasted after last year’s race that no riders tested positive for banned substances, have acknowledged that riders were not tested for the blood booster EPO.","Cycling Race Says It Failed to Test for EPO",1035,"Sports"
"826","2007-12-07T05:00:00+0000","CLASSICAL.","Classical Music/Opera Listings",2102,"Arts"
"827","2007-04-20T04:00:00+0000","MOVIES.","Movie Guide and Film Series",2145,"Movies"
"828","2007-06-05T05:00:00+0000","","Concert halls push the limits of design and sound",2318,"Arts"
"829","2007-06-03T04:00:00+0000","The exuberant forms and fluid interiors of a group of new concert halls make the great halls of the late 19th century seem fusty by comparison.","The Best Buildings You’ll Ever Hear",2398,"Arts"
"830","2007-11-16T05:00:00+0000","You don’t need to wait for Angelina Jolie to rise from the vaporous depths naked to know that this “Beowulf” isn’t your high school teacher’s Old English epic poem.","Confronting the Fabled Monster, Not to Mention His Naked Mom",1081,"Movies"
"831","2007-10-16T05:00:00+0000","","Art as a target for vandals: The cost of freedom",1196,"Arts"
"832","2007-09-11T04:00:00+0000","Many Europeans are looking inward to explain why Islamist extremists have made the Continent a favored target, while the U.S. has been spared for the past six years.","Seeking Terror’s Causes, Europe Looks Within",1168,"World"
"833","2007-05-15T04:00:00+0000","Climatologists  said in February it was “very unlikely” that the crucial flow of warm water to Europe known as the North Atlantic Current would stall in this century.","Scientists Back Off Theory of a Colder Europe in a Warming World",1129,"Science"
"834","2007-03-20T04:00:00+0000","Mr. Backus assembled and led the I.B.M. team that created Fortran, the first widely used programming language.","John W. Backus, 82, Fortran Developer, Dies",1138,"Business Day"
"835","2007-02-08T05:00:00+0000","","Murder of editor puts focus on Turkish port - Europe - International Herald Tribune",1098,"World"
"836","2007-11-13T05:00:00+0000","","Challenges to both left and right in U.S. on global warming",1123,"Health"
"837","2007-11-12T05:00:00+0000","","Baghdad's oasis of tolerance",1051,"World"
"838","2007-11-09T05:00:00+0000","People who program series like Family Matters and the New Victory Theater on 42nd Street pride themselves on pushing the envelope through challenging shows for families. But they walk a fine line to do it.","Caution: Children Watching. How Far Do You Push the Envelope?",1105,"Arts"
"839","2007-09-25T04:00:00+0000","Pacific Northwest Ballet, starting its 2007-8 home season in Seattle with an all-Balanchine triple bill, is an example of how the generations are changing.","An Idiomatic Balanchine, Walking the Walk in Seattle",1076,"Arts"
"840","2007-09-18T05:00:00+0000","","Soccer: Aussies march on at Women's World Cup; technology, too",1073,"Sports"
"841","2007-08-25T04:00:00+0000","The company’s strategy of remodeling its restaurants and tailoring its menu options is paying off in Europe.","To Woo Europeans, McDonald’s Goes Upscale",1116,"Business Day"
"842","2007-08-22T04:00:00+0000","Benny Feilhaber, who was born in Brazil but moved to the United States as a youngster, had a breakout summer playing for the United States in the Concacaf Gold Cup and Copa América.","Young American Cashes In on Gold Cup",1066,"Sports"
"843","2007-05-14T05:00:00+0000","","In Turkey's religious heartland, secularism thrives",1152,"World"
"844","2007-03-13T05:00:00+0000","","From some scientists, a call to Gore to temper the alarm",1058,"World"
"845","2007-01-03T05:00:00+0000","Many retailers left their stores after the attack on the World Trade Center, but now fashion is venturing back — though perhaps in somewhat less high-end forms.","SoHo Bounces Back as a Fashion Center",1044,"Real Estate"
"846","2007-12-26T05:00:00+0000","Cellphones made the services of the professional letter writer obsolete, but G. P. Sawant isn’t complaining.","The Ink Fades on a Profession as India Modernizes",1148,"World"
"847","2007-10-12T18:54:20+0000","Michael and Ashley top the New York City charts of baby names, but notice the increase in boys whose names are “two syllables ending in n,” and girls whose names end in the “a” sound.","Most Popular Baby Name Starts With M (or Is It J?)",901,"New York"
"848","2007-10-12T05:00:00+0000","","Tyler Brûlé : The best and worst in meeting venues",1125,"Travel"
"849","2007-09-30T04:00:00+0000","Though the travel companies don’t advertise it, they often charge different prices on the foreign version of their Web sites. Some tips on how to uncover deals across country domains.","When the Best Deals Don’t End in .Com",1041,"Travel"
"850","2007-09-09T05:00:00+0000","","All sides await verdict in Microsoft-EU case",1240,"Business Day"
"851","2007-06-15T05:00:00+0000","","Le Mans returns to summit of its former glory",1257,"Sports"
"852","2007-01-14T05:00:00+0000","","Artist lays down plaques for victims of the Nazis - Europe - International Herald Tribune",1116,"World"
"853","2007-12-23T05:00:00+0000","","Arsenal moves to Premier League lead",1159,"Sports"
"854","2007-10-25T05:00:00+0000","","Europe slow to turn to shared ownership",1108,"Real Estate"
"855","2007-10-03T04:00:00+0000","Mr. Grizzard was a versatile actor who achieved his greatest renown on the stage, playing everything from Shakespeare to Shaw, from Neil Simon to Edward Albee.","George Grizzard, Actor Noted for Albee Roles, Dies at 79",1088,"Theater"
"856","2007-08-14T05:00:00+0000","","Poland's status still ""not equal,"" foreign minister says",1029,"World"
"857","2007-08-09T05:00:00+0000","","Cycling: Break in the gloom as T-Mobile stays in saddle",1130,"Sports"
"858","2007-06-17T05:00:00+0000","","Europeans fear 48-hour notice plan will impede travel to U.S.",1097,"World"
"859","2007-05-22T04:00:00+0000","The high spirits outside the Cannes screening rooms frequently stand in jarring contrast to the misery displayed within contemporary European cinema.","Alienated Europeans, Through a Cold Lens",1061,"Movies"
"860","2007-11-13T05:00:00+0000","","Adu arrives with a young friend",1171,"Sports"
"861","2007-08-03T05:00:00+0000","","Soccer: Talent search brings boy to Europe",1151,"Sports"
"862","2007-08-03T05:00:00+0000","","Only 9 years old, youngster captures the soccer world",1079,"Sports"
"863","2007-07-24T05:00:00+0000","","Doping scandal piling up on Tour de France",1072,"Sports"
"864","2007-06-21T05:00:00+0000","","Lockheed presents new fighter at Paris Air Show",1215,"Business Day"
"865","2007-06-15T05:00:00+0000","","Congress debates stricter visa rules",1103,"World"
"866","2007-02-08T05:00:00+0000","Eliot Weinberger, a previous finalist for the National Book Critics Circle award, set off a stir by saying that one of this year's nominees, Bruce Bawer, had engaged in “racism as criticism.”","In Books, a Clash of Europe and Islam",1142,"Books"
"867","2007-02-06T05:00:00+0000","Lost Goya painting is recovered, French weekly sued over cartoons, Indian bombing film opens and more culture news.","Arts, Briefly ",1128,"Arts"
"868","2007-12-11T05:00:00+0000","Walter Mosley’s three-book deal,  “Lost” Prokofiev score gets a second life, OSHA investigates ballet dancer’s fall and more culture news.","Arts, Briefly",1163,"Arts"
"869","2007-12-21T05:00:00+0000","","A letter writer in India signs off on the new economy",1105,"World"
"870","2007-11-25T05:00:00+0000","The Organization for Timeshare in Europe estimates that the continent has fewer than 25 fractional developments. But that may be about to change.","In Europe, Fractional Properties Have Room to Grow",1109,"Great Homes & Destinations"
"871","2007-11-13T05:00:00+0000","","An oasis from politics amid the turmoil in Baghdad",1052,"World"
"872","2007-10-21T05:00:00+0000","","A new player takes a bet on old media",1091,"Business Day"
"873","2007-08-14T04:00:00+0000","Gino Segre followed the family tradition of becoming a physicist, but then turned to writing science history for a broader audience.","In the Footsteps of His Uncle, Then His Father",1140,"Science"
"874","2007-05-16T05:00:00+0000","","Scientists back off theory of a colder Europe in a warming world",1097,"Health"
"875","2007-05-07T05:00:00+0000","","Danone skims U.S. talent to market organic offering",1091,"Business Day"
"876","2007-06-15T05:00:00+0000","","U.S. proposals on visa rules raise fears in Europe",1112,"World"
"877","2007-04-26T05:00:00+0000","","Putin picks up a bargaining chip with suspension of treaty",1121,"World"
"878","2007-03-22T04:00:00+0000","Former Vice President Al Gore insisted that global warming requires an aggressive federal response.","Gore Warns Congress of ‘Planetary Emergency’",1074,"Washington"
"879","2007-03-19T04:00:00+0000","John W. Backus assembled and led the I.B.M. team that created Fortran, the first widely used programming language.","John W. Backus, 82, Fortran Developer, Dies",1140,"Obituaries"
"880","2007-03-12T10:48:41+0000","","Will Uncle Sam Come After Private Equity?",1173,"Business Day"
"881","2007-01-21T05:00:00+0000","Passing the bike each day with his daughter, he wondered who rode it, and why it was left behind.","Dad’s Motorcycle Diary",1016,"New York"
"882","2007-01-10T05:00:00+0000","In the argot of the soccer world, they are known as minnows — clubs from the lower divisions who often change into giant-killers, waiting and dreaming of upsets in domestic cup competitions.","Savoring a Taste of Life in the Big Time",1164,"Sports"
"883","2007-08-23T05:00:00+0000","","Soccer: International games overshadowed by killing",1177,"Sports"
"884","2007-05-12T04:00:00+0000","The Danone Group is turning to an American to introduce organic yogurts in Europe, starting in France.","Tough Sell: An American Yogurt in Paris",1126,"Business Day"
"885","2007-03-26T05:00:00+0000","","Swimming: Hansen edges Kitajima in breaststroke final",1082,"Sports"
"886","2007-03-12T05:00:00+0000","","In Britain, measuring youth poverty by drink, drugs and arrests",1056,"World"
"887","2007-04-27T04:00:00+0000","MOVIES.","Movie Guide and Film Series",2392,"Movies"
"888","2007-11-13T05:00:00+0000","","European Commission plans for energy market deregulation offer mixed prospects for consumers",1302,"Business Day"
"889","2007-11-11T05:00:00+0000","","Mickelson wins HSBC Champions tournament",1158,"Sports"
"890","2007-10-26T05:00:00+0000","","First Person: My big fat French parental leave",1115,"Fashion & Style"
"891","2007-11-13T05:00:00+0000","","European Commission plans for energy market deregulation offer mixed prospects for consumers",1302,"Business Day"
"892","2007-11-11T05:00:00+0000","","Mickelson wins HSBC Champions tournament",1158,"Sports"
"893","2007-10-26T05:00:00+0000","","First Person: My big fat French parental leave",1115,"Fashion & Style"
"894","2007-09-05T05:00:00+0000","","Police arrest 3 in German terror plot",1283,"World"
"895","2007-08-03T05:00:00+0000","","Kid stuff? Young soccer talent draws quick attention",1126,"Sports"
"896","2007-01-21T05:00:00+0000","","Friction undermines Chelsea's ambitions - Sports - International Herald Tribune",1207,"Sports"
"897","2007-01-03T05:00:00+0000","","Education proving key to a longer life - Health & Science - International Herald Tribune",1244,"Health"
"898","2007-11-13T05:00:00+0000","","Community-scale projects in Europe beat sustainable energy and climate change targets",1174,"World"
"899","2007-08-17T05:00:00+0000","","For McDonald's, a European redesign starts to pay off",1168,"Business Day"
"900","2007-07-06T05:00:00+0000","","Review: On Royalty",1329,"Arts"
"901","2007-03-21T04:00:00+0000","Jay DeMerit is likely to get a look from U.S. soccer Coach Bob Bradley, but he faces stiff competition for a place in the middle of a defense that includes Oguchi Onyewu and Jimmy Conrad.","In U.S. Camp at Last, DeMerit Hopes to Show He Belongs",1138,"Sports"
"902","2007-12-09T05:00:00+0000","Tension and wariness reign as Kosovo moves toward its expected secession from Serbia. ","NATO Says It’s Prepared to Keep Peace in Kosovo",1273,"World"
"903","2007-10-09T05:00:00+0000","","Distribution of nets splits malaria fighters",1139,"Health"
"904","2007-09-24T05:00:00+0000","","U.S. drug agency exposes a steroid web with China tie",1182,"Sports"
"905","2007-08-02T04:00:00+0000","The Bosnian government, encouraged by Western governments, is concerned that the country should not be seen as a haven for Islamic militants.","Bosnia Plans to Expel Arabs Who Fought in Its War",1166,"World"
"906","2007-01-17T05:00:00+0000","The Real Madrid club president, Raúl Calderón, said that David Beckham was going to Hollywood to be “half a film star.”","Real Madrid Club President Says a Mouthful",1113,"Sports"
"907","2007-02-22T05:00:00+0000","Prime Minister Tony Blair’s announcement of a withdrawal in southern Iraq was in sharp contrast to the continuing American troop buildup in Baghdad.","Britain to Trim Iraq Force by 1,600 in Coming Months",1204,"World"
"908","2007-07-25T05:00:00+0000","","Battered Tour de France ousts a top team in new doping scandal",1181,"Sports"
"909","2007-07-16T04:00:00+0000","A pair of John Lennon’s wire-rimmed sunglass frames brought high bids, a new Saatchi gallery in London will charge no admission, and more culture news.","Arts, Briefly",1203,"Arts"
"910","2007-07-06T05:00:00+0000","","Review: Fateful Choices",1262,"Arts"
"911","2007-03-04T05:00:00+0000","","For Sevilla, victory over Barcelona is sweet",1169,"Sports"
"912","2007-02-28T05:00:00+0000","The meetings, which are to focus strictly on stabilizing Iraq, could open a door to a diplomatic channel.","U.S. Set to Join Iran and Syria in Talks on Iraq",1210,"Washington"
"913","2007-10-17T04:00:00+0000","Few soccer players in the world have elicited such rapt devotion as the lissome French striker Thierry Henry. Now the Barcelona player is making a strong move into the U.S. market.","At Times, a Star Enjoys Blending In",1115,"Sports"
"914","2007-09-23T05:00:00+0000","","Cloud of worry gathers over wireless health risks",1245,"Business Day"
"915","2007-09-23T04:00:00+0000","Garrison Keillor’s new novel is set in his “little town that time forgot.”","Out There on the Edge of the Prairie",1204,"Books"
"916","2007-07-08T04:00:00+0000","A British historian describes 10 strategic choices that helped shape the outcome of World War II.","Seemed Like a Good Idea at the Time",1236,"Books"
"917","2007-07-08T04:00:00+0000","Jeremy Paxman’s affable book looks at monarchies, in Britain and elsewhere.","God Save the Queen",1300,"Books"
"918","2007-05-15T05:00:00+0000","","Europeans grapple with right-to-die issue",1257,"World"
"919","2007-10-25T05:00:00+0000","","Close your windows, the Mac Leopard is here",1198,"Technology"
"920","2007-08-08T05:00:00+0000","","British military asks U.S. forces to leave Afghan province",1193,"World"
"921","2007-04-22T04:00:00+0000","The use of wireless technology to make mobile devices into less distracting companions is growing, and it has ambitions beyond hands-free cellphones.","Bluetooth Plays Matchmaker: M3, Meet MP3",1173,"Automobiles"
"922","2007-02-27T05:00:00+0000","","U.S. to join Iraq talks that include Iran and Syria",1138,"World"
"923","2007-02-21T05:00:00+0000","New National Endowment awards are announced, Britney Spears enters rehab and more culture news.","Arts, Briefly",1258,"Arts"
"924","2007-02-08T05:00:00+0000","The poverty, unemployment and lack of opportunity that afflict many of Turkey’s cities are crushing in the regional capital of Trabzon — especially for young people.","Suspects in Journalist’s Killing Came From a Hotbed of Turkish Ultranationalist Sentiment",1256,"World"
"925","2007-01-12T05:00:00+0000","","Asean pursues EU-style regional integration - Asia - Pacific - International Herald Tribune",1218,"World"
"926","2007-01-03T05:00:00+0000","","Education is proving key to a longer life - Americas - International Herald Tribune",1230,"World"
"927","2007-10-09T04:00:00+0000","Mosquito nets have the potential to save lives in malaria-plagued countries. But what is the best way to get them to those who need them most?","Distribution of Nets Splits Malaria Fighters",1185,"Health"
"928","2007-07-18T05:00:00+0000","","British Open golf: Europeans dream of stealing their show",1195,"Sports"
"929","2007-06-22T04:00:00+0000","Lockheed Martin’s $600 billion Joint Strike Fighter program is only now moving off the drawing board and into first flight.","Painting a Rosy Picture of a Costly Fighter Jet",1227,"Business Day"
"930","2007-02-28T05:00:00+0000","","U.S. set to join Iran and Syria in talks on Iraq",1162,"World"
"931","2007-10-02T04:00:00+0000","Scientists are concerned by this summer’s massive polar ice melt and its implications for the future.","Arctic Melt Unnerves the Experts",1308,"Science"
"932","2007-06-03T04:00:00+0000","Uncertainty on exchange rates enhances the lure of upfront cruise deals.","As Dollar Sinks, European Cruises Could Be a Bargain",1278,"Travel"
"933","2007-05-25T04:00:00+0000","A redesigned StarWars.com empowers fans to get into the action, a milestone for ABC’s “World News,” Keira Knightley wins lawsuit over weight and more culture news.","Arts, Briefly",1270,"Arts"
"934","2007-04-04T20:57:51+0000","","Sloshing",1299,"Opinion"
"935","2007-03-11T05:00:00+0000","","In Britain, measuring youth poverty by drink, drugs and arrests",1228,"World"
"936","2007-02-17T05:00:00+0000","","Spain cooling on immigrants -  - International Herald Tribune",1223,"World"
"937","2007-01-12T05:00:00+0000","","Swedish politician's advice to immigrants? Try to fit in  -  - International Herald Tribune",1205,"World"
"938","2007-11-01T04:00:00+0000","The Wooster Group’s “Hamlet” is a sometimes ravishing, often numbing homage to a fabled theatrical event.","Looks It Not Like the King? Well, More Like Burton",1224,"Theater"
"939","2007-08-12T05:00:00+0000","","Woody Allen remembers Ingmar Bergman",1316,"Arts"
"940","2007-06-04T05:00:00+0000","","EU moving further on climate change",1302,"Business Day"
"941","2007-02-17T05:00:00+0000","","Spain cooling on immigrants -  - International Herald Tribune",1223,"World"
"942","2007-01-12T05:00:00+0000","","Swedish politician's advice to immigrants? Try to fit in  -  - International Herald Tribune",1205,"World"
"943","2007-11-01T04:00:00+0000","The Wooster Group’s “Hamlet” is a sometimes ravishing, often numbing homage to a fabled theatrical event.","Looks It Not Like the King? Well, More Like Burton",1224,"Theater"
"944","2007-08-12T05:00:00+0000","","Woody Allen remembers Ingmar Bergman",1316,"Arts"
"945","2007-06-04T05:00:00+0000","","EU moving further on climate change",1302,"Business Day"
"946","2007-02-18T05:00:00+0000","Michael Frayn, playwright, novelist and part-time philosopher, wonders what a world without us would be.","Self Centered",1369,"Books"
"947","2007-01-13T05:00:00+0000","Sweden’s recently appointed minister for integration and gender equality tends to draw attention for her unusually blunt pronouncements about the place of immigrants in Swedish society.","Sweden’s Lightning Rod in a Storm Over Assimilation",1237,"World"
"948","2007-12-07T05:00:00+0000","The reinstallation of European paintings  at the Metropolitan Museum unquestionably delivers perspective, and it delivers it in a wealth of visual links from gallery to gallery.","Age of Splendor Expands",1296,"Arts"
"949","2007-09-20T05:00:00+0000","","Prying open Europe's pharmacies",1310,"Business Day"
"950","2007-08-12T04:00:00+0000","Behind Ingmar Bergman’s unblinking inquiries of God
and death and love was a filmmaker’s filmmaker.","The Man Who Asked Hard Questions",1370,"Movies"
"951","2007-06-25T05:00:00+0000","","After 6 months, Mexican leader tries to build economic momentum",1247,"Business Day"
"952","2007-02-28T05:00:00+0000","Brown (Bobby) is jailed,  Brown (Foxy) fights back, Brown (James) to be sampled and more culture news.","Arts, Briefly",1280,"Arts"
"953","2007-01-12T05:00:00+0000","","Swedish politician's advice to immigrants? Try to fit in  - Europe - International Herald Tribune",1208,"World"
"954","2007-08-26T04:00:00+0000","Behind the Iron Curtain,
a star was forming,
accumulating lovers
and a K.G.B. file.","The Nureyev Nobody Knows, Young and Wild",1307,"Arts"
"955","2007-06-11T05:00:00+0000","","A fatwa free-for-all in the Islamic world",1347,"World"
"956","2007-05-31T05:00:00+0000","","FPL finds U.S. wind power boom not always on solid ground",1216,"Business Day"
"957","2007-02-07T05:00:00+0000","","In lands of the euro, a growing number of local currencies",1312,"Business Day"
"958","2007-12-28T05:00:00+0000","Selective listings from dance critics of The New York Times.","Dance Listings",1238,"Arts"
"959","2007-10-13T04:00:00+0000","Proximity is the cost, and virtue, of a civil and democratic society. We run the risk that some lunatic or self-promoter will violate the public trust of an open space because we value that space as a democratic ideal.","A Symbol of Freedom and a Target for Terrorists",1312,"Arts"
"960","2007-08-21T05:00:00+0000","","For sex researcher, a never-ending backlash",1333,"Health"
"961","2007-07-10T04:00:00+0000","Webdenda.","People and Accounts of Note",1286,"Business Day"
"962","2007-05-08T05:00:00+0000","","In London, two small shows attract full houses, for good reason",1165,"Arts"
