"","created_time","snippet","headline","wordcount","section"
"226","2016-05-04T21:32:25+0000","The Danish-born model turned actress was married to the French director and was his muse and leading lady.","Anna Karina Recalls Her Life in Film With Jean-Luc Godard",1024,"Movies"
"227","2016-02-18T22:50:22+0000","A number of dancers with roles in the latest George Balanchine’s “The Nutcracker” are making their debuts in new roles at City Ballet.","Sugarplum Fairies and Cavaliers Move Ahead at City Ballet",930,"Arts"
"228","2016-02-12T22:51:04+0000","Mr. Rukun, the Indonesian subject of “The Look of Silence,” says he used the director, Joshua Oppenheimer, “to expose the terrible ongoing effects of the genocide.”","Adi Rukun, Neither Silent Nor Intimidated",1004,"Movies"
"229","2016-06-24T11:05:38+0000","The Copa América has delivered a tournament that many see as superior to the Euros. Perhaps this will change with the Euros now in the knockout phase.","Smaller Copa América So Far Trumps the Bloated Euros",988,"Sports"
"230","2016-02-09T18:20:17+0000","Also, Freud offers Austrian fare; Gentilly travels to New Orleans; and Bark has closed.","Salvation Burger in Turtle Bay Joins the Family",903,"Food"
"231","2016-09-13T21:04:37+0000","Get recommendations from New York Times reporters and editors, highlighting great stories from around the web. Today, great reads from Tom Jolly, Dell’Antonia and others.","What We’re Reading",369,"Blogs"
"232","2016-01-18T21:10:33+0000","The choreographer Mette Ingvartsen led this ambitious, audacious lecture-performance of sex as a social rather than a private phenomenon, at MoMA PS1.","Review: ‘69 positions’ Explores the Sexual Politics in Performance",414,"Arts"
"233","2016-12-03T16:55:13+0000","Natalie Gonnella-Platts heads the Women’s Initiative at the George W. Bush Institute, which promotes access to education, health care and economic opportunities.","A Women’s Advocate Who’s Passionate About Progress",361,"Job Market"
"234","2016-11-11T11:00:04+0000","The Arthur J in Manhattan Beach gives you a fine steakhouse experience.","In Southern California, Hot Steaks With a Cool Vibe",415,"Travel"
"235","2016-12-09T11:21:45+0000","The countries were “deeply concerned” about a humanitarian crisis in the north of Rakhine State, where a counterinsurgency has sealed off the persecuted Rohingya minority.","14 Countries Press Myanmar to Allow Aid in Rohingya Areas",420,"World"
"236","2016-05-12T02:45:55+0000","Mr. Safer was known as much for his hard-hitting reporting as the quirky stories he covered.","Morley Safer Retiring as Longest-Serving ‘60 Minutes’ Reporter",461,"Business Day"
"237","2016-04-08T20:56:18+0000","There were some very appealing numbers in this concert, which opened a 14-event program, Project-B-way/95.","Review: ‘Broadway Premieres’ at Symphony Space",414,"Arts"
"238","2016-05-31T18:07:09+0000","The estimate by the antislavery group Walk Free Foundation is 28 percent more than its last estimate two years ago.","Modern Slavery Estimated to Trap 45 Million People Worldwide",393,"World"
"239","2016-03-18T09:31:43+0000","A reader asks: Is there a specific amount of time at which to keep your heart rate up during interval training to get the most benefit?","Ask Well: 20 Seconds to Better Fitness?",389,"Health"
"240","2016-02-29T01:56:20+0000","Missed the Academy Awards? Let’s get you caught up.","Oscars 2016: Just the Highlights",433,"Movies"
"241","2016-01-26T20:01:52+0000","A group of globe-trotting food lovers called Ghetto Gastro want the Bronx recognized for the talent of its homegrown chefs.","Food Lovers Aim to Give the Bronx Its Due",407,"Food"
"242","2016-04-27T18:55:47+0000","The minister, Vlad Alexandrescu, said he was stepping down after failing to resolve a dispute at the Bucharest National Opera.","Romania’s Culture Minister Steps Down as Ballet Dispute Continues",404,"Arts"
"243","2016-03-29T22:08:17+0000","A report from Secretary General Ban Ki-moon gave recommendations to the General Assembly president, who does not report to the secretary general.","U.N. Panel’s Call for Transparency Highlights Limits of Oversight",405,"World"
"244","2016-06-19T05:00:15+0000","“The Tunnel” adapts “The Bridge,” the Scandinavian thriller, for a Eurostar crowd. And Jim Gaffigan skewers himself for a second season.","What’s on TV Sunday",481,"Arts"
"245","2016-04-22T11:18:05+0000","It’s hard to imagine Britain without Her Majesty: stoic, steadfast, kind, greatly revered and remarkably robust.","Queen Elizabeth II, Still Going Strong at 90",444,"Opinion"
"246","2016-02-28T20:35:42+0000","The newspaper drama about the Catholic Church cover-up of sexual abuse by priests snatched top honors over “The Revenant,” considered the favorite by many.","Oscars 2016: Chris Rock Scores and ‘Spotlight’ Takes Center Stage",1604,"Movies"
"247","2016-01-14T19:08:24+0000","Thoughts from Jennifer Lawrence, Sylvester Stallone and other newly minted contenders.","‘Everyone Here Is a Star’: Oscar Nominees React",0,"Movies"
"248","2016-02-18T23:50:14+0000","A guide to movies playing at theaters in the New York City area, as well as select festivals and film series.","Movie Listings for Feb. 19-25",3041,"Movies"
"249","2016-02-25T22:59:46+0000","The festival, which runs through March 20, is well stocked with hair-raising tales (all with generally happy resolutions, of course).","New York International Children’s Film Festival Gives Young Heroes Their Stage",1014,"Movies"
"250","2016-02-08T23:53:47+0000","At a luncheon for the Oscar nominees, the president of the Academy of Motion Picture Arts and Sciences indicated that the awards ceremony would proceed as planned.","Despite Diversity Controversy, Oscars Ceremony Remains Intact",477,"Business Day"
"251","2016-03-25T16:41:35+0000","The Dutch siblings, who traveled the world and considered New York a second home, were on the phone with their mother when two bombs exploded.","Alexander and Sascha Pinczowski, Siblings on Way to New York, Killed at Brussels Airport",441,"World"
"252","2016-08-31T10:00:32+0000","There are still used car lots and lighting stores along Austin’s Burnet Road, but this well-trafficked thoroughfare is fast becoming a hot spot.","Five Places to Go in Austin",430,"Travel"
"253","2016-07-08T09:05:56+0000","The brand’s 90th anniversary couture show was held on the waters of the Trevi Fountain, and replete with myths and legends.","Fendi’s Dolce Vita",506,"Fashion & Style"
"254","2016-03-01T06:00:03+0000","Vice Media launches its new cable channel, Viceland. Alicia Vikander portrays the British pacifist Vera Brittain. And the networks report on Super Tuesday.","What to Watch Tuesday",493,"Arts"
"255","2016-01-08T14:50:53+0000","With predictions of up to three million new arrivals, this year is shaping up to be even more challenging than 2015.","Europe Must Do Better on Refugees",503,"Opinion"
"256","2016-09-26T00:27:30+0000","Great goaltending by Jaroslav Halak and an overtime goal by Tomas Tatar gave Team Europe, a conglomerate of eight countries, a 3-2 victory.","Team Europe Upsets Sweden in World Cup of Hockey Semifinal",469,"Sports"
"257","2016-12-03T19:42:13+0000","A woman says a group of men assaulted her in April at a five-star hotel where she was staying as part of a package tour.","India’s Police Investigating Rape Accusation by American Tourist",475,"World"
"258","2016-10-06T21:38:10+0000","Bonnie Duncan uses a clothesline as both set and plot device in this solo family show about a battle of wits between a little girl and a mischievous rodent.","‘Squirrel Stole My Underpants,’ and Therein Hangs a Tale",436,"Theater"
"259","2016-06-17T20:49:38+0000","The Scandinavian series “The Bridge” inspired FX’s “The Tunnel,” and now a very similar British-French series of the same title on PBS.","Review: You Know, This ‘Tunnel’ Feels Really Familiar",541,"Arts"
"260","2016-06-05T14:09:19+0000","“Feed the Beast” stars David Schwimmer, and Kanye West and Death Cab for Cutie perform at the Governors Ball.","What’s on TV Sunday",515,"Arts"
"261","2016-06-01T17:21:10+0000","The latest report contradicted a finding that meat found in the man’s home was from a goat and not from a cow — the holy Hindu symbol he was accused of eating.","Muslim Killed by Indian Mob Had Beef in His Home, New Report Says",480,"World"
"262","2016-01-29T16:15:04+0000","From cassoulet to Nigella Lawson’s coffee walnut layer cake, here’s what to cook.","13 Recipes for the Weekend",538,"Food"
"263","2016-07-11T13:24:59+0000","Interest rates are ultralow across the globe. Here’s what that may be telling us about the economic future.","Can We Ignore the Alarm Bells the Bond Market Is Ringing?",1272,"The Upshot"
"264","2016-05-05T12:54:03+0000","Four books offer different takes on the challenging subjects of death and mourning.","‘Cry, Heart, but Never Break,’ and More",1078,"Books"
"265","2016-05-24T10:00:08+0000","Repeated studies have found no clinically significant differences between results from cholesterol tests done on a full stomach and those done after fasting.","Ask Well: Should You Fast Before a Cholesterol Test?",515,"Health"
"266","2016-04-10T03:11:14+0000","European golfers have continued to dominate the United States in the Ryder Cup and have won the other three major tournaments repeatedly. But the Masters has remained elusive.","Europeans’ Masters Title Drought Looms Large in Rory McIlroy’s 77",503,"Sports"
"267","2016-08-05T15:10:04+0000","Take a minute to think about mise en place.","What to Cook This Weekend",553,"Food"
"268","2016-07-06T17:56:38+0000","His work was so understated that it has slipped into the canon of modern British life with little fanfare.","The Design Legacy of David Mellor, as English as Afternoon Tea",544,"T Magazine"
"269","2016-04-26T05:00:04+0000","In “Fresh Off the Boat,” Louis and Jessica remember meeting. Scientists visit the Chernobyl plant. And a bride awaits the world’s end in “Melancholia.”","What’s on TV Tuesday",526,"Arts"
"270","2016-02-10T01:19:22+0000","The claim comes after a long effort to secure the territory, and mineral rights, to Arctic Ocean seabed, including an area under the North Pole.","Russia Presents Revised Claim of Arctic Territory to the United Nations",500,"World"
"271","2016-02-04T03:31:20+0000","Back in fighting form, Mr. Trump continued his claim that Senator Ted Cruz won the Iowa caucuses by deception.","Donald Trump Tells Crowd in Arkansas, ‘I Think I Came in First’ in Iowa",526,"U.S."
"272","2016-06-15T18:01:04+0000","The question of whether Britain should remain in the European Union devolved into a naval confrontation in London on Wednesday.","A ‘Brexit’ Battle on the Thames Between Nigel Farage and Bob Geldof",490,"World"
"273","2016-04-28T20:24:35+0000","A fellow filmmaker examines the work of this German director from the close perspective of friendship.","Review: Rainer Werner Fassbinder’s Intense World and His Films",559,"Movies"
"274","2016-09-02T13:50:09+0000","The country’s cabinet unanimously agreed to fight the $14.5 billion decision, and politicians are expected to debate it next week.","Ireland to Appeal Tax Ruling in Apple Case",539,"Technology"
"275","2016-12-28T21:25:42+0000","These cool new products and collections will make sticking to your resolutions a little less daunting.","5 New Year’s Resolutions You Can Buy",0,"Fashion & Style"
"276","2016-07-14T17:37:59+0000","A court ruled that villagers can open a criminal case against the family of a Muslim man bludgeoned to death over rumors that he slaughtered and ate a cow.","Family of Slain Man in India May Be Charged With Cow Slaughter",507,"World"
"277","2016-01-01T16:15:03+0000","Peas and mustard greens, pizza dough, Alfred Lord Tennyson and more recipes for the New Year.","Happy New Year!",554,"Food"
"278","2016-09-13T20:07:23+0000","Day after day, an elderly woman recalls the Spanish Basque country of her youth — while forgetting she is consigned to a retirement home in Chile.","I’m Not From Here",454,"Opinion"
"279","2016-03-13T16:49:28+0000","Agatha Christie’s “And Then There Were None” comes to television. And “The Wave,” a Norwegian take on the disaster movie genre, is on iTunes.","What to Watch Sunday",519,"Arts"
"280","2016-03-03T22:52:37+0000","","Movie Listings for March 4-10",3376,"Movies"
"281","2016-12-05T19:56:00+0000","The two groups are putting aside divisions to combat a wave of Islamophobia and anti-Semitism since Donald J. Trump’s election, and to resist whatever may come next.","Both Feeling Threatened, American Muslims and Jews Join Hands",1215,"U.S."
"282","2016-08-02T15:11:56+0000","Tucked inside Grand Central Terminal, Claus Meyer’s new restaurant offers a sleek trip to Scandinavia.","All Aboard the Nordic Express, at Agern",1246,"Food"
"283","2016-02-26T15:30:22+0000","An American billionaire pays $500 million for paintings by de Kooning and Pollock.","A Blockbuster Deal Reassures the Art World",1332,"Arts"
"284","2016-06-30T20:15:57+0000","Just days after the “Brexit” vote, companies and cities across Europe hope to profit by luring businesses and helping those wishing to move.","As Britain Faces Uncertainty, Europeans Jockey for London’s Business",1267,"Business Day"
"285","2016-08-27T18:46:30+0000","Many are turning to DNA testing after years of frustration with bureaucratic hurdles and flawed records.","Adopted Koreans, Stymied in Search of Birth Parents, Find Hope in a Cotton Swab",1236,"World"
"286","2016-05-10T10:46:52+0000","The attack on my neighborhood in November 2015 didn’t put an end to my time as an expat in France. It gave me a fuller view of the place I call home.","Spring in Paris, My Adopted City, After the Attacks",1935,"Travel"
"287","2016-05-20T14:15:38+0000","While the chance of a draw in most games is judged to be about 25 percent, in the Spezia-Ascoli game on Friday it is fully 60 percent.","Why Bettors See an Obscure Italian Game as Almost a Sure Thing",648,"Sports"
"288","2016-09-30T17:05:03+0000","One Star House Party will pop up in cities like Taipei, Seoul, New York and more.","Embarking on a Two-Year Pop-Up Kitchen, Around the World",574,"T Magazine"
"289","2016-09-20T18:25:55+0000","Underwater archaeologists found 2,000-year-old bones at the Greek island Antikythera site.","Human Remains Found at Ancient Roman-Era Shipwreck",583,"Science"
"290","2016-08-11T18:54:53+0000","Researchers used radiocarbon dating of the eye lenses of these lazy-looking predators to estimate that they have a life expectancy of at least 272 years.","Meet the Greenland Shark. It Could Be the Longest-Living Vertebrate.",557,"Science"
"291","2016-08-27T18:30:17+0000","It is now possible and practical to provide a significant part of the nation’s power needs from ocean winds.","The Unlimited Power of Ocean Winds",544,"Opinion"
"292","2016-08-15T07:21:13+0000","Pushing down the cost of borrowing doesn’t address weak consumer demand or weak business investment.","What Two Years of Negative Interest Rates in Europe Tell Us",569,"Opinion"
"293","2016-07-06T16:01:01+0000","Roger Federer, John Travolta and Eddie Redmayne are among the famous men tapped by watchmakers.","Match the Celebrity Pitchman to His Watch",0,"Fashion & Style"
"294","2016-09-20T10:25:41+0000","Why the country’s policy makers are reviewing an unconventional part of their effort to shake the Japanese economy out of its doldrums.","Japan’s Negative Interest Rates Explained",591,"Business Day"
"295","2016-01-30T19:01:13+0000","The costume designer for “Downton Abbey” on Russian murder mysteries, watching the river flow, and, of course, beautiful gowns.","Anna Robbins",565,"Opinion"
"296","2016-11-30T00:21:13+0000","According to an official inquiry, the American-led attacks in September were conducted under the “good-faith belief” that the targets were Islamic State militants.","‘Unintentional’ Human Error Led to Airstrikes on Syrian Troops, Pentagon Says",520,"World"
"297","2016-02-09T15:42:39+0000","A review of nearly 22,000 companies found an association between gender diversity in executive positions and increased profitability.","Women in Company Leadership Tied to Stronger Profits, Study Says",541,"Business Day"
"298","2016-08-22T01:45:05+0000","Ms. Crothers, an acolyte of Lennie Tristano who maintained equal allegiance to the avant-garde and jazz tradition, recorded more than two dozen albums.","Connie Crothers, Jazz Pianist, Composer and Instructor, Dies at 75",546,"Arts"
"299","2016-03-01T18:10:29+0000","Also, a speakeasy on Avenue A; Wylie Dufresne’s new Indian fast-casual spot; and more.","Peter Grünauer Is Back on the Upper East Side",535,"Food"
"300","2016-04-01T19:07:40+0000","The deal would have consolidated the French telecom market, but both sides failed to agree on terms for the proposed $11.4 billion deal.","Orange and Bouygues Telecom Call Off Takeover Talks",529,"Business Day"
"301","2016-02-06T19:30:05+0000","An energy executive on space, Arctic and oil exploration, the smell of spinning vinyl and an exhausting movie.","Gordon Ballard",552,"Opinion"
"302","2016-06-17T16:48:02+0000","Mr. Refn calls his horrific “The Neon Demon” a “funny movie” and says it could even be seen as a twisted take on “A Star Is Born.”","Nicolas Winding Refn Dissects His Bloody Confection",1325,"Movies"
"303","2016-08-20T19:48:44+0000","Countries and companies vie for the title of Rio’s Best Party, offering night life to athletes once their competitions are over.","At the Olympics, the Thrill of Victory, the Agony of Defeat and the Lure of the Dance Floor",1405,"Sports"
"304","2016-03-17T22:53:33+0000","The director, an early French Modernist, enlisted the painter Fernand Léger in designing this Art Deco extravaganza from 1924.","L’Herbier’s ‘L’Inhumaine’ Offers a Painterly Touch on a Silent Canvas",1292,"Movies"
"305","2016-02-26T00:02:19+0000","","Movie Listings for Feb. 26-Mar. 3",3526,"Movies"
"306","2016-05-16T16:03:33+0000","The world-renowned geneticist scrutinizes ancient DNA for clues to the earliest chapters in the human story.","Eske Willerslev Is Rewriting History With DNA",3046,"Science"
"307","2016-08-05T12:44:55+0000","Über 650 Westeuropäer wurden bei Angriffen getötet, die vom Islamischen Staat ausgeführt oder inspiriert wurden","How Many People Have Been Killed in ISIS Attacks Around the World",0,"World"
"308","2016-03-25T16:01:21+0000","More than 1,200 people outside of Iraq and Syria have been killed in attacks inspired or coordinated by the Islamic State.","How Many People Have Been Killed in ISIS Attacks Around the World",0,"World"
"309","2016-07-15T12:20:06+0000","The refurbished Palace Hotel has gone through several iterations since it first opened in 1875 as the largest hotel in the world.","In San Francisco, the Classy Renewal of a Gilded Age Hotel",577,"Travel"
"310","2016-02-04T10:56:26+0000","Economic forecasts by the European Union were scaled back, as regional disruptions and a global slowdown were expected to hamper trade.","European Growth Seen as Slower Than Previously Predicted",635,"Business Day"
"311","2016-01-05T09:40:01+0000","The takeover would cement Orange as the largest mobile carrier in France, though any deal would face tough questions from the region’s antitrust regulators.","Orange in Talks to Acquire Bouygues Telecom",612,"Business Day"
"312","2016-11-21T22:26:59+0000","Delightful presents big and small from the editors of T Magazine.","2016 Holiday Gift Guide - T Magazine",0,"Multimedia/Photos"
"313","2016-05-10T09:00:26+0000","Gérard Depardieu stars in a new French Netflix series that is pure political soap, leaning hard on a sleazy city stereotype.","Review: ‘Marseille’ Proves That American Cable Clichés Are Easy Exports",586,"Arts"
"314","2016-12-23T15:03:59+0000","A physicist and her students used a balloon and a bed of nails to make it easier to visualize how water droplets respond to a spiky surface.","When Water Balloons Hit a Bed of Nails and Don’t Pop",634,"Science"
"315","2016-12-24T03:00:33+0000","David Steinberg challenges us with the toughest puzzle of the week.","Say Yes or No",694,"Crosswords & Games"
"316","2016-07-19T11:28:09+0000","The $3.2 billion penalty comes less than a week after the bloc’s antitrust chief announced a new round of charges against Google.","Price-Fixing Truck Makers Get Record E.U. Fine: $3.2 Billion",584,"Business Day"
"317","2016-04-06T21:23:03+0000","Here’s what you need to know at the end of the day.","Your Wednesday Evening Briefing: Panama Papers, Pfizer, Donald Trump",603,"NYT Now"
"318","2016-06-03T22:02:05+0000","David Schwimmer and Jim Sturgess star as business partners who struggle to restart a restaurant.","Review: ‘Feed the Beast,’ AMC’s Solemn New Restaurant and Crime Drama",586,"Arts"
"319","2016-05-28T11:00:24+0000","From north to south, Sweden to Portugal, trains are a relaxing destination all their own.","6 European Countries, 9 Days, 0 Planes",2212,"Travel"
"320","2016-06-17T17:07:55+0000","From the Watching team, expert TV and movie recommendations for the next few days.","What You Should Watch: Dad Edition",1530,"Arts"
"321","2016-03-05T18:22:27+0000","Grasping the basics of how negative rates work and how they may be affecting the United States is important for anyone with money in the markets.","In the Bizarro World of Negative Interest Rates, Saving Will Cost You",1369,"Your Money"
"322","2016-08-30T23:57:31+0000","The minister’s remarks drew broad criticism in a country trying to convince female tourists that they need not fear sexual assault.","Safety Tip for Visitors From India’s Culture Minister: ‘Don’t Wear Skirts’",651,"World"
"323","2016-04-14T20:33:48+0000","There were at least 55 New York Times articles about the monster in 1934.","When the Loch Ness Monster Was in The Times",696,"Arts"
"324","2016-03-30T10:45:24+0000","After hearing my young patient’s story, I now make it a point to ask all my patients if they are being made fun of or bullied at school.","Checking on Bullying at the Doctor’s Office",632,"Health"
"325","2016-06-03T16:21:57+0000","A new condo in Brooklyn aims to blend the space and character of the area’s townhouses with the amenities of a residential tower.","A Townhouse Alternative in Boerum Hill",659,"Real Estate"
"326","2016-04-19T06:00:04+0000","The e-commerce group has set its sights on the region, selling a €100 million stake to Alabbar Enterprises in Dubai, United Arab Emirates.","Yoox Net-a-Porter Sells Stake to Middle East Retail Giant",650,"Business Day"
"327","2016-06-13T17:34:30+0000","Kiko Kostadinov, who showed his first collection during London Collections Men today, seeks to make elevated workwear for his generation of creative men.","Person to Know: The Men’s Wear Phenom Straight Out of School",619,"T Magazine"
"328","2016-05-17T05:00:05+0000","Corrections appearing in print on Tuesday, May 17, 2016.","Corrections: May 17, 2016",729,"Corrections"
"329","2016-04-13T01:53:08+0000","Mr. Anderson performed on radio as a teenager with Orson Welles’s Mercury Theater and appeared on Broadway, in films and on television.","Arthur Anderson, Voice of Lucky Charms Cereal’s Leprechaun, Dies at 93",649,"Arts"
"330","2016-05-20T10:00:44+0000","For his next installation, the artist has turned to the palace near Paris and its majestic gardens.","Olafur Eliasson Envisions a Spectacle in Versailles",743,"Arts"
"331","2016-06-01T20:59:12+0000","The elusive furniture dealer John Birch helped set the market for $50,000 Nakashima tables and $100,000 Hans Wegner chairs. Then the market caught up with him.","Wyeth, a Temple of Midcentury Modern Design, Seeks New Wallets",2215,"Fashion & Style"
"332","2016-04-12T21:44:35+0000","A series of missteps cost the Romanian national ballet company on Tuesday its artistic director, Johan Kobborg, and the dancer Alina Cojocaru.","Romanian Ballet Company Loses Its Leading Lights",747,"Arts"
"333","2016-12-11T00:04:52+0000","The musician, who did not attend the ceremony, said he was honored and recognized that he was “in very rare company.”","Bob Dylan’s Nobel Prize Acceptance Speech",824,"Arts"
"334","2016-09-01T02:27:41+0000","Thanks to a scheduling change, players like the Flyers’ Pierre-Eduoard Bellemare, a Frenchman, can play for their countries in final qualifying tournaments.","For Some N.H.L. Players, a Welcome Shot at Olympic Qualifying",796,"Sports"
"335","2016-06-20T19:28:40+0000","Investors have been reluctant to invest in new listings, and several companies have delayed announcing their intention to file until after the vote on Thursday.","Uncertainty Over ‘Brexit’ Vote Damps I.P.O.s in London",770,"Business Day"
"336","2016-06-07T21:36:55+0000","The actor, who will always be known for “Friends,” takes on his first role as a series regular in more than a decade in this AMC series.","David Schwimmer on Life After Ross and His Role in ‘Feed the Beast’",669,"Arts"
"337","2016-02-25T22:28:45+0000","The costume design winner is often a period film, but the action hit may surprise academy watchers.","Costume Design and Makeup Oscar Predictions",805,"Movies"
"338","2016-01-17T18:35:26+0000","Margrethe Vestager’s warning shot comes ahead of a Jan. 31 deadline for Europe and the United States to reach a new data-sharing agreement.","European Antitrust Chief Takes Swipe at Privacy Issue",635,"Technology"
"339","2016-10-05T16:51:15+0000","In the aftermath of the American-led invasion of Afghanistan, I was sent to manage telecommunications and logistics for The Times — and I recorded what I saw with a small digital camera.","15 Years Ago: The Times Establishes a Bureau in Kabul",0,"Times Insider"
