"","created_time","snippet","headline","wordcount","section"
"636","2007-07-05T05:00:00+0000","","The winner and new champion, with 66 hot dogs",791,"World"
"637","2007-05-02T04:00:00+0000","Mr. von Weizsäcker wrote more than 30 books and founded the prestigious Max Planck Institute for Social Sciences.","Carl F. von Weizsäcker, German Physicist and Thinker, Dies at 94",839,"World"
"638","2007-04-02T05:00:00+0000","","France caters to market for the most simple of computers",869,"Technology"
"639","2007-02-09T05:00:00+0000","The success of locally issued vouchers defies traditional economic logic, but local officials say it helps their economies.","In the Land of the Euro, Small Towns Adopt Alternative Currencies",831,"Business Day"
"640","2007-01-18T05:00:00+0000","","Frequent Traveler Q & A: New route to Greenland  - Travel & Dining - International Herald Tribune",817,"Travel"
"641","2007-07-05T04:00:00+0000","In Coney Island on Wednesday, Takeru Kobayashi was unseated by an engineering student from California.","The Winner and New Champion, With 66 Hot Dogs",830,"New York"
"642","2007-06-21T05:00:00+0000","","French companies warm to proposed VAT increase",804,"Business Day"
"643","2007-04-02T04:00:00+0000","With new software that controls digital video, the creative team at 3LD (or 3-Legged Dog) are hoping to produce some dazzling, perhaps even shocking, effects on stage.","Illusory Characters With Startling Stage Presence",857,"Theater"
"644","2007-03-20T05:00:00+0000","","Being a youth in Britain isn't so easy these days",823,"World"
"645","2007-11-01T05:00:00+0000","","EU report on Turkey deals new blow to Ankara's membership bid",891,"World"
"646","2007-10-21T05:00:00+0000","","Webster shoots 64 to take Portugal Masters by two strokes",878,"Sports"
"647","2007-10-14T04:00:00+0000","History and archaeology shed light on a character from Icelandic sagas.","Girl of the North Country",868,"Books"
"648","2007-02-20T05:00:00+0000","","EU vows 30% cut in greenhouse gas - Business - International Herald Tribune",795,"Business Day"
"649","2007-02-20T05:00:00+0000","","EU offers 30% cut in greenhouse gas  - Business - International Herald Tribune",798,"Business Day"
"650","2007-08-02T05:00:00+0000","","Russia plants flag on sea floor at North Pole",898,"World"
"651","2007-03-20T05:00:00+0000","","Being a youth in Britain isn't so easy these days",823,"World"
"652","2007-02-20T05:00:00+0000","","EU vows 30% cut in greenhouse gas - Business - International Herald Tribune",795,"Business Day"
"653","2007-02-20T05:00:00+0000","","EU offers 30% cut in greenhouse gas  - Business - International Herald Tribune",798,"Business Day"
"654","2007-02-13T14:41:05+0000","Japan ties to push the issue of commercial whaling, but half the world’s members of the International Whaling Commission boycott the meeting…","Whaling Commission Consensus Is Japan’s Moby Dick",867,"Blogs"
"655","2007-12-05T21:05:37+0000","The so-called parity in college football and basketball is nothing compared to the tight competition at the top of the men’s N.C.A.A. soccer tournament.","College Cup: All Hail the Underdog",885,"Sports"
"656","2007-10-11T05:00:00+0000","","SOCCER, Euro 2008: Preview",820,"Sports"
"657","2007-10-04T05:00:00+0000","","Stockholm's best-kept secret  -  second-hand shopping",764,"Fashion & Style"
"658","2007-07-30T04:00:00+0000","Alberto Contador, a 24-year-old from Madrid who rides for the Discovery Channel team, won the overall title, the youngest rider in a decade to win cycling’s biggest event.","Contador Wins a Scarred Tour de France",867,"Sports"
"659","2007-07-19T05:00:00+0000","","Pondering free access to French museums",919,"Arts"
"660","2007-06-25T05:00:00+0000","","Report calls on Europe to move on global warming",879,"World"
"661","2007-06-12T05:00:00+0000","","Pakistan cricket coach was not murdered, Jamaica police now rule",893,"World"
"662","2007-04-20T05:00:00+0000","","Tyler Brûlé: Notes of high camp at Eurovision Song Contest",842,"Arts"
"663","2007-02-23T05:00:00+0000","President Bush put on a white coat and visited a laboratory in Franklinton, N.C., to promote his goals for making alternative fuels from switch grass, woodchips and other plant waste.","Bush Makes a Pitch for Amber Waves of Homegrown Fuel",763,"Washington"
"664","2007-01-30T17:01:50+0000","A survey suggesting that Muslim youth in Britain is increasingly politicized — and radical — is causing a stir…","Survey: Young Muslims in Britain Are More Politicized. Blame Multiculturalism?",824,"Blogs"
"665","2007-12-12T05:00:00+0000","Bert and Kathi Childers of Dallas are part-time residents of Gozo, a 40-square-mile dot in the Mediterranean between the tip of Italy and Tunisia.","On a Maltese Island, Bargain Vacation Rentals",898,"Great Homes & Destinations"
"666","2007-11-13T05:00:00+0000","","Guantánamo by the numbers",932,"Opinion"
"667","2007-10-27T04:00:00+0000","By sponsoring marathons, ING is hoping to make a name for itself in a cluttered financial services market where one company seems indistinguishable from the next.  ","ING Learns to Build Its Identity 26.2 Miles at a Time",809,"Sports"
"668","2007-09-30T05:00:00+0000","","Cycling, World Championships: Marta Bastianelli of Italy wins women's road race",725,"Sports"
"669","2007-08-22T05:00:00+0000","","Golf: Players agree new cup is a grind",832,"Sports"
"670","2007-07-13T04:00:00+0000","The German cycling team that once featured Lance Armstrong’s archrival in the Tour de France is aiming to sign some top American riders for next season. ","T-Mobile Sees a Chance To Lure American Riders",768,"Sports"
"671","2007-06-18T04:00:00+0000","By fall, software developers will start introducing offerings aimed at nudging players to bond with Grandma, balance their hormones and eat their peas.","Focus of Video Games Shifts to Lure More Casual Players",818,"Technology"
"672","2007-03-09T05:00:00+0000","","Review: The Solitude of Thomas Cave",880,"Arts"
"673","2007-02-26T05:00:00+0000","The selection of Ellen DeGeneres as host of the Academy Awards was a reaffirmation of television as the dominant water-cooler medium — for the moment.","Bringing a Touch of Daytime to Hollywood’s Biggest Night",827,"Arts"
"674","2007-02-26T05:00:00+0000","","EU takes on German telecom law favoring Deutsche Telekom",832,"Business Day"
"675","2007-02-14T05:00:00+0000","","From Iraq to Sweden, human smugglers have a package to suit all refugees - Europe - International Herald Tribune",909,"World"
"676","2007-02-03T05:00:00+0000","Two cases of press censorship highlight a particularly troubling pattern, in which the Moroccan regime represses the progressive voices it claims to champion.","Censorship’s New Clothes",840,"Opinion"
"677","2007-11-25T05:00:00+0000","Reviews of releases by Yo Gotti and Pleasure P, Hatesphere, Alison Hinds, Burial and Trace Adkins.","Hits and Misses and Hairy Shows",810,"Arts"
"678","2007-11-01T05:00:00+0000","","EU report criticizes pace of reform in Turkey",902,"World"
"679","2007-09-01T04:00:00+0000","George Green, C.E.O. of Hearst Magazines International, discusses why magazines can still thrive outside the United States.","Overseas, a Rosier Picture for Magazines",862,"Business Day"
"680","2007-08-06T05:00:00+0000","","Cost-conscious consumers transform European mobile phone market",800,"Technology"
"681","2007-07-22T04:00:00+0000","Michael Rasmussen put in a stellar ride Saturday in the first of two time trials in the Tour de France and maintained his grip on the yellow jersey by one minute over Cadel Evans.","Rasmussen Keeps Lead by a Minute in the Tour",829,"Sports"
"682","2007-07-18T14:05:43+0000","","Living with Music:<br /> A Playlist from Geoff Dyer",780,"Arts"
"683","2007-12-30T05:00:00+0000","A professed grouch travels to pleasurable destinations and analyzes their formulas for happiness.","Why Is That Land Smiling?",872,"Books"
"684","2007-12-18T05:00:00+0000","","Naspers of South Africa moves into East Europe with acquisition of Tradus",799,"Technology"
"685","2007-07-05T05:00:00+0000","","Upstart takes hot-dog eating title",794,"World"
"686","2007-05-17T04:00:00+0000","The Metropolitan Opera says its simulcasting of operas into theaters was so successful that it will expand the program next season.","Met Opera to Expand Simulcasts in Theaters",873,"Arts"
"687","2007-04-02T04:00:00+0000","International sports institutions are imposing vigorous controls over the online use of game information and photographs.","Sports Organizations Try to Limit Online Reporting",889,"Technology"
"688","2007-01-30T05:00:00+0000","Mr. Tetley’s pioneering fusion of ballet and modern dance challenged taboos and rattled purists but influenced major companies worldwide.","Glen Tetley, 80, Pioneering Choreographer, Dies",808,"Arts"
"689","2007-01-09T05:00:00+0000","","Merkel rebukes Russia - Europe - International Herald Tribune",858,"World"
"690","2007-12-03T05:00:00+0000","","Sri Lanka's Muralitharan breaks record for taking wickets",821,"Sports"
"691","2007-12-03T05:00:00+0000","","Sri Lanka's Muralitharan breaks record for taking wickets",821,"Sports"
"692","2007-10-25T04:00:00+0000","Millions of hay fever sufferers needlessly put up with congestion and bleary eyes.","An Abundance of Remedies but Little Relief",861,"Health"
"693","2007-10-16T05:00:00+0000","","Your trip doesn't have to be all business",850,"Business Day"
"694","2007-08-23T05:00:00+0000","","International pilot training program cuts actual flight time",794,"Business Day"
"695","2007-03-11T05:00:00+0000","The protagonist of Georgina Harding’s debut novel is stranded in the Arctic.","Survivor",877,"Books"
"696","2007-02-04T05:00:00+0000","","Censorship's new clothes - Opinion - International Herald Tribune",817,"Opinion"
"697","2007-01-24T05:00:00+0000","","Cricket: In Ashes shadow, a test series to watch - Sports - International Herald Tribune",813,"Sports"
"698","2007-10-28T12:48:00+0000","","The Week Ahead: Oct. 28-Nov. 3",1862,"Arts"
"699","2007-04-01T04:00:00+0000","The drama. The passion. The deaths. A ballet’s many versions remind a critic how they originally seduced him.","Confessions of a ‘Romeo’ Fiend",1883,"Arts"
"700","2007-09-09T04:00:00+0000","Can you picture Benicio Del Toro playing the lead in a romantic comedy? He can.","He’d Love to Lighten Up, but Darkness Pulls Him Back",1909,"Movies"
"701","2007-07-13T04:00:00+0000","Selective listings from dance critics of The New York Times.","Dance Listings",1748,"Arts"
"702","2007-11-09T05:00:00+0000","Art20 at Seventh Regiment Armory, Earl Cunningham at Berry-Hill Galleries, Miranda Lichtenstein at Elizabeth Dee and more.","Art in Review",1928,"Arts"
"703","2007-05-08T04:00:00+0000","Research into the genetics of obesity indicates that each person has a comfortable weight range to which the body gravitates. ","Genes Take Charge, and Diets Fall by the Wayside",1870,"Health"
"704","2007-01-02T05:00:00+0000","","That touch of mink is back in demand  - Culture - International Herald Tribune",1689,"Arts"
"705","2007-09-13T05:00:00+0000","","Less is more for Helen Alfredsson, Europe's eclectic Solheim Cup captain",868,"Sports"
"706","2007-08-19T05:00:00+0000","","Fighting antisocial behavior on social networking sites",939,"Business Day"
"707","2007-07-23T05:00:00+0000","","Seducing France into affairs of the art",958,"Arts"
"708","2007-07-22T05:00:00+0000","","Vinokourov takes Saturday Tour trial",912,"Sports"
"709","2007-04-04T04:00:00+0000","“In recent months I’ve been marveling at meat’s several shades of red, and at their creation stories.”","The Red-Meat Miracle, and Other Tales From the Butcher Case",951,"Food"
"710","2007-01-25T05:00:00+0000","","Europe faces labor shortages as population ages - Business - International Herald Tribune",963,"Business Day"
"711","2007-10-01T05:00:00+0000","","Politicus: Assessing Russia's plans with a rare fortitude",1001,"World"
"712","2007-09-24T05:00:00+0000","","Before summit, a yawning gap on climate change",990,"World"
"713","2007-09-14T04:00:00+0000","In the auction world almost nothing is more intriguing than fresh, unknown collections. Sotheby’s has found a new route to them this fall: outsourcing the sale’s expert.","So 20th Century, and So Popular",984,"Arts"
"714","2007-06-12T04:00:00+0000","Reversing course, police said today that Bob Woolmer, a Pakistani cricket coach, died of natural causes in March.","Cricket Coach Not Murdered, Jamaican Police Say",967,"World"
"715","2007-05-27T05:00:00+0000","","The Tour de France breaks a fan's heart",871,"Sports"
"716","2007-04-11T04:00:00+0000","For weeks now, human rights groups have been urging Ethiopia, which has a nettlesome human rights record, to shed some light on the detainees.","Ethiopia Holding 41 Suspects Who Fought With Somali Islamists, Officials Confirm",912,"World"
"717","2007-03-23T05:00:00+0000","","EU's celebration of 50th birthday avoids difficult issues",972,"World"
"718","2007-02-09T05:00:00+0000","","Spotlight: Romanian business chief sees EU entry outdoing 1989 - Business - International Herald Tribune",882,"Business Day"
"719","2007-01-25T05:00:00+0000","","Europe faces labor shortages as population ages - Business - International Herald Tribune",949,"Business Day"
"720","2007-12-24T09:48:57+0000","Drafted prospects and top picks for 2008 and 2009 have a chance to shine in the Czech Republic","25 to Watch at the World Juniors",734,"Sports"
"721","2007-07-23T04:00:00+0000","The new government of President Nicolas Sarkozy is pondering whether to allow free access to the permanent collections of major French museums.","Seducing France Into Affairs of the Art",987,"Arts"
"722","2007-07-11T05:00:00+0000","","Germans grapple with terrorism threat",877,"World"
"723","2007-04-15T04:00:00+0000","Even when it was in American waters for more than 140 years, the America’s Cup never had this grand a stage, and the question worth asking is if it is still America’s cup at all.","America’s Cup Draws the Haves and the Have-Yachts to Spain",1015,"Sports"
"724","2007-03-30T04:00:00+0000","At documentary-only events, audiences can expect a much wider range of styles and subjects than would be found at a general film festival.","Seekers of True Stories Unite",906,"Travel"
"725","2007-02-28T05:00:00+0000","","U.S. agrees to discuss Iraq with Iran",951,"World"
"726","2007-01-25T05:00:00+0000","While there is little doubt that the income gap has widened in recent years, the situation is not as unfair as some of the numbers seem to imply.","Incomes and Inequality: What the Numbers Don’t Tell Us",897,"Business Day"
"727","2007-09-13T05:00:00+0000","","Less is more for Helen Alfredsson, Europe's eclectic Solheim Cup captain",868,"Sports"
"728","2007-08-19T05:00:00+0000","","Fighting antisocial behavior on social networking sites",939,"Business Day"
"729","2007-07-23T05:00:00+0000","","Seducing France into affairs of the art",958,"Arts"
"730","2007-07-22T05:00:00+0000","","Vinokourov takes Saturday Tour trial",912,"Sports"
"731","2007-02-28T05:00:00+0000","","U.S. agrees to discuss Iraq with Iran",951,"World"
"732","2007-01-25T05:00:00+0000","While there is little doubt that the income gap has widened in recent years, the situation is not as unfair as some of the numbers seem to imply.","Incomes and Inequality: What the Numbers Don’t Tell Us",897,"Business Day"
"733","2007-07-11T04:00:00+0000","In the wake of the latest British scare, Germany has erupted in a rancorous dispute over how to deal with a terrorist threat.","Debate on Terror Threat Stirs Germany",956,"World"
"734","2007-02-27T05:00:00+0000","New reports are raising questions about whether drugs that have been used by cancer patients might actually be harming them.","Studies Show Anemia Drugs May Harm Cancer Patients",976,"Health"
"735","2007-02-24T05:00:00+0000","Levi Leipheimer blew away his closest competitors in the Stage 5 time trial, extending his overall lead to 21 seconds and giving him an apparent lock on the Tour of California title with two stages left.","In Time Trial, Leipheimer Adds to Lead",930,"Sports"
"736","2007-08-19T05:00:00+0000","","Fighting antisocial behavior on social networking sites",936,"Technology"
"737","2007-07-17T04:00:00+0000","Cycling’s crackdown on doping, and the retirement of Lance Armstrong in 2005, have caused teams to change their strategies and opened up the Tour de France overall competition.

","Race for the Yellow Jersey is Wide Open This Year",862,"Sports"
"738","2007-05-27T04:00:00+0000","This year’s Tour de France will still be a beautiful sight. Just don’t take it seriously and don’t take the riders into your heart.","A Sport Can No Longer Peddle Denial",885,"Sports"
"739","2007-01-21T05:00:00+0000","","Soccer: Friction undermines Chelsea's ambitions - Sports - International Herald Tribune",970,"Sports"
"740","2007-09-29T04:00:00+0000","Now in its fourth year, New York Musical Theater Festival addresses the difficulties of mounting a new musical by providing a forum where audiences and producers can view a cross-section of the current crop.","Trial and Error: The Hunt for Usable Musicals",897,"Theater"
"741","2007-10-01T05:00:00+0000","","Retreating Ice: A blue Arctic Ocean in summers by 2013?",918,"Health"
"742","2007-09-25T05:00:00+0000","","U.S. exposes illicit China steroid sales",931,"World"
"743","2007-09-14T04:00:00+0000","Pissarro emerges from this exhibition  at the Jewish Museum as an artist whose subtly anti-authoritarian stance propelled painting into the next century.","The Radical Eye of Impressionism’s Patriarch",932,"Arts"
"744","2007-07-18T05:00:00+0000","","Car-bomb suspect in Australia tried to contact police",943,"World"
"745","2007-06-21T05:00:00+0000","","Insulin makers expected to benefit as problems arise for diabetes pills",840,"Business Day"
"746","2007-04-17T04:00:00+0000","Richard Gere’s kiss ignites protests in India, artists and filmmakers intersect at Tribeca Film Festival, Edward Norton to play Incredible Hulk and more culture news.","Arts, Briefly ",944,"Arts"
"747","2007-04-08T04:00:00+0000","A retro thriller pays homage to the 1960s secret agent Modesty Blaise.","My Favorite Spy",917,"Books"
"748","2007-02-22T05:00:00+0000","The British gave up trying to win their war in southern Iraq a long time ago, and they probably accomplished as much as they could.","The End of the Alliance",992,"Opinion"
"749","2007-02-22T05:00:00+0000","","They did about as much as they could do - Opinion - International Herald Tribune",998,"Opinion"
"750","2007-02-06T05:00:00+0000","","Soccer: England illuminates path from darkness - Sports - International Herald Tribune",1033,"Sports"
"751","2007-01-21T05:00:00+0000","The futures of optimists and pessimists.","You Are What You Expect",980,"Magazine"
"752","2007-04-08T04:00:00+0000","A retro thriller pays homage to the 1960s secret agent Modesty Blaise.","My Favorite Spy",917,"Books"
"753","2007-02-24T05:00:00+0000","Pierre Bayard, a Paris University literature professor, has written a survivor’s guide for literature students, “How to Talk About Books You Haven’t Read?”","Read It? No, but You Can Skim a Few Pages and Fake It",945,"Books"
"754","2007-11-10T05:00:00+0000","Here are data that provide a historical snapshot to the detention center at Guantánamo Bay, Cuba.","Guantánamo by the Numbers",881,"Opinion"
"755","2007-10-14T05:00:00+0000","","SOCCER, Euro 2008: Roundup",801,"Sports"
"756","2007-08-23T05:00:00+0000","","Devotion to beauty paying off for Brazil",961,"Business Day"
"757","2007-07-22T04:00:00+0000","ALBI, France, July 21 — Written off for dead less than a week ago after he faltered in the Alps, Alexander Vinokourov demolished the field on Saturday to win the first of two individual time trials and show that he retains an outside chance to tri...","",945,"Sports"
"758","2007-06-26T05:00:00+0000","","Facelift for Malmo, one of Sweden's working-class towns",909,"Real Estate"
"759","2007-05-20T05:00:00+0000","","Luna Rossa wins place in Louis Vuitton Cup final",905,"Sports"
"760","2007-03-21T05:00:00+0000","","Gore warns of 'planetary emergency'",874,"World"
"761","2007-11-16T05:00:00+0000","Alan Saret at the Drawing Center, “Modernism” at Seventh Regiment Armory, Anthony Caro at Mitchell-Innes & Nash and more.","Art in Review",2019,"Arts"
"762","2007-10-07T08:27:00+0000","","The Week Ahead: Oct. 7-13",2023,"Arts"
"763","2007-06-15T04:00:00+0000","MOVIES.","Movie Guide and Film Series",2076,"Movies"
"764","2007-11-19T05:00:00+0000","","For U.S. firms, foreign sales cushion domestic slowdown",1055,"Business Day"
"765","2007-10-21T05:00:00+0000","","Youngsters in Spain take first steps in big shoes",1085,"Sports"
"766","2007-10-10T04:00:00+0000","Germany’s focus on the 2008 European Championship has been deflected by a growing controversy over the decision of one of its youth players to withdraw from a match in Israel.","Politics and Sports Clash on German Under-21 Team",1032,"Sports"
"767","2007-10-07T04:00:00+0000","“Lars and the Real Girl” is a breakthrough script for the “fiercely unsentimental” writer Nancy Oliver.","Guy and Doll, and the Woman Behind Them",1019,"Movies"
"768","2007-09-25T04:00:00+0000","For the first time in many European countries, nonprescription drugs are being sold over the counter at outlets other than pharmacies.","Prying Open European Pharmacies",1069,"Business Day"
"769","2007-09-15T04:00:00+0000","Jay Winik vividly portrays the tumultuous times in which America embarked on the great experiment, testing whether a continent-size country could successfully establish representative government. (Montesquieu, for one, had thought republics only s...","With Powdered Wigs and Powerful Ideas, They Changed the Way the World Is Run",989,"Books"
"770","2007-08-11T04:00:00+0000","The crisis over doping has turned even Lance Armstrong into a pessimist about cycling’s short-term future.","Armstrong Team Falls With Cycling’s Image",1007,"Sports"
"771","2007-04-26T04:00:00+0000","The goods at the newer MoMA Design Store are savvy just like the customers.","A Trip to the Gift Shop Is Like a Day at the Museum",1002,"Fashion & Style"
"772","2007-03-14T04:00:00+0000","Statements made by Samuel Eto’o, who recently returned from knee surgery, have upset some teammates and management at F.C. Barcelona.","Bruised Feelings and a Shaky Knee for F.C. Barcelona",1008,"Sports"
"773","2007-02-28T05:00:00+0000","Mia Hamm and Julie Foudy, pillars of the United States women’s national team, were the only players elected to the National Soccer Hall of Fame Tuesday.","Two Soccer Pioneers End Journey at the Hall of Fame",1037,"Sports"
"774","2007-01-17T05:00:00+0000","","Constitution and trade at top of Merkel's EU agenda  - Europe - International Herald Tribune",992,"World"
"775","2007-09-13T05:00:00+0000","","Inkster, Kerr, Pressel, Creamer, Gulbis and batch of U.S. rookies seek to retain Solheim Cup",1035,"Sports"
"776","2007-03-21T05:00:00+0000","","Gore warns of 'planetary emergency'",1004,"World"
"777","2007-03-07T05:00:00+0000","","Lyon falls, and Totti makes the difference",980,"Sports"
"778","2007-12-27T05:00:00+0000","The most promising touch at the new Carrots store in San Francisco was in the restroom: carrot wallpaper in the style of William Morris.","Has Vitamin A. Needs a Martini.",1035,"Fashion & Style"
"779","2007-08-28T05:00:00+0000","","Athletics: As others are deposed, Isinbayeva stays a queen",1058,"Sports"
"780","2007-07-29T05:00:00+0000","","Alice Rawsthorn: The eclectic charm of Murray Moss",1016,"Fashion & Style"
"781","2007-07-24T05:00:00+0000","","Vinokourov bounces back to win 15th Tour de France stage",958,"Sports"
"782","2007-07-19T04:00:00+0000","A summer retreat up the Hudson, built around a farmer’s grain bin.","The Classic Box, Well Rounded",1048,"Home & Garden"
"783","2007-04-01T04:00:00+0000","Competition from workers in China and other poor countries is pushing American and European policy makers to borrow from each other’s playbooks.","A Bridge Over the Atlantic, in Labor Policy",1000,"Business Day"
"784","2007-03-09T05:00:00+0000","This year’s  European Fine Art Fair at Maastricht, with 220 dealers, will show antiques and fine art worth about $1 billion, according to the fair’s organizers.","Dealers and Collectors Make the Pilgrimage to Maastricht",1029,"Arts"
"785","2007-03-07T05:00:00+0000","","Soccer: Lyon falls as Totti is the difference",975,"Sports"
"786","2007-11-22T05:00:00+0000","","Lightly-rated American team of Weekley and Slocum take lead",1195,"Sports"
"787","2007-11-19T05:00:00+0000","","Sarkozy gives transit strike the silent treatment in France",1022,"World"
"788","2007-09-12T05:00:00+0000","","From radical Islamic leader to disillusioned ex-prisoner",960,"World"
"789","2007-08-05T05:00:00+0000","","British troops report gains in Afghanistan",986,"World"
"790","2007-12-12T05:00:00+0000","","After deadly assault, Algeria offers details on attackers",1013,"World"
"791","2007-11-12T05:00:00+0000","","After deadly assault, Algeria offers details on attackers",1014,"World"
"792","2007-10-19T04:00:00+0000","“Things We Lost in the Fire” bends over backward to prove that serious American movies can hold their own with the best films from overseas.","An Addict and a Widow With a Lot of Pain to Heal",973,"Movies"
"793","2007-06-20T15:34:00+0000","Canada, the only team besides Mexico and the United States to win the Gold Cup, finds itself in the position to shake things up in the Concacaf pecking order.","Quality Soccer Talent North of the 49th Parallel",969,"Sports"
"794","2007-04-01T05:00:00+0000","","Global change is pushing Europe and the United States closer on labor policy",957,"Business Day"
"795","2007-03-28T05:00:00+0000","","Making amends for 'dirty' air travel",1015,"Business Day"
